Document_ID,Topic,Text,Top_Keywords
351,6,台风 杜苏芮 残余 环流 影响 河北 北京 天津 河南 降雨 具有 极端 致灾 风险 暴雨 尽量减少 出门 不到 山区 游玩 不吃 洪水 浸泡 食物 生水 开水 桶装水 水后 伤口处 消毒 互相 提醒,"食物, 风险, 不吃, 互相, 伤口处"
352,18,升级 发布 暴雨 红色 预警 信号 升级 发布 暴雨 红色 预警 信号 预计 夜间 夜间 本区 出现 大暴雨 部分 地区 大暴雨 主要 降雨 过程 出现 时至 山区 山区 出现 强降水 诱发 中小 河流 洪水 山洪 地质灾害 次生 灾害 风险 较大 城市 低洼地区 容易 出现 积水 注意 防范,"出现, 大暴雨, 暴雨, 夜间, 预警"
353,-1,海报 远离 行洪 河道 要点 记牢,异常值
354,18,注意 防范 北京 朝阳 暴雨 红色 升级 发布 朝阳区 气象台 升级 发布 暴雨 红色 预警 信号 预计 夜间 夜间 朝阳区 出现 大暴雨 局地 大暴雨 主要 降雨 过程 出现 时至 强降水 诱发 中小 河流 洪水 次生 灾害 风险 较大 城市 低洼地区 容易 出现 积水 注意 防范,"出现, 大暴雨, 暴雨, 夜间, 预警"
355,5,台风 杜苏芮 残余 环流 影响 河北 北京 天津 河南 降雨 具有 极端 致灾 风险 暴雨 尽量减少 出门 不到 山区 游玩 遇到 被困 涉水 出行 皮肤 划伤 情况 避险 不吃 洪水 浸泡 食物 生水 开会 桶装水 水后 伤口处 消毒 互相 提醒 生命 时报,"洪水, 暴雨, 台风, 影响, 杜苏芮"
356,5,台风 杜苏芮 残余 环流 影响 河北 北京 天津 河南 降雨 具有 极端 致灾 风险 暴雨 尽量减少 出门 不到 山区 游玩 遇到 被困 涉水 出行 皮肤 划伤 情况 避险 不吃 洪水 浸泡 食物 生水 开会 桶装水 水后 伤口处 消毒 互相 提醒 生命 时报,"洪水, 暴雨, 台风, 影响, 杜苏芮"
357,5,台风 杜苏芮 残余 环流 影响 河北 北京 天津 河南 降雨 具有 极端 致灾 风险 暴雨 尽量减少 出门 不到 山区 游玩 遇到 被困 涉水 出行 皮肤 划伤 情况 避险 不吃 洪水 浸泡 食物 生水 开会 桶装水 水后 伤口处 消毒 互相 提醒,"洪水, 暴雨, 台风, 影响, 杜苏芮"
358,2,海淀 发布 暴雨 红色 预警 大暴雨 局地 大暴雨 海淀区 气象台 升级 发布 暴雨 红色 预警 信号 预计 夜间 夜间 海淀区 出现 大暴雨 局地 大暴雨 主要 降雨 过程 出现 时至 山区 山区 出现 强降水 诱发 中小 河流 洪水 山洪 地质灾害 次生 灾害 风险 较大 城市 低洼地区 容易 出现 积水 注意 防范 海淀 气象,"出现, 大暴雨, 山区, 夜间, 山洪"
359,2,海淀 发布 暴雨 红色 预警 大暴雨 局地 大暴雨 海淀区 气象台 升级 发布 暴雨 红色 预警 信号 预计 夜间 夜间 海淀区 出现 大暴雨 局地 大暴雨 主要 降雨 过程 出现 时至 山区 山区 出现 强降水 诱发 中小 河流 洪水 山洪 地质灾害 次生 灾害 风险 较大 城市 低洼地区 容易 出现 积水 注意 防范 海淀 气象,"出现, 大暴雨, 山区, 夜间, 山洪"
360,2,北京 升级 发布 最高级别 暴雨 红色 预警 全市 大暴雨 北京市 气象台 升级 发布 最高级别 暴雨 红色 预警 信号 预计 夜间 夜间 本市 出现 大暴雨 西部 南部 大暴雨 主要 降雨 过程 出现 时至 全市 大暴雨 房山 门头沟 昌平 海淀 石景山 丰台 延庆 大兴 通州 西城 东城 朝阳 部分 地区 有特 大暴雨 山区 山区 出现 强降水 诱发 中小 河流 洪水 山洪 地质灾害 次生 灾害 风险 较大 城市 低洼地区 容易 出现 积水 注意 防范,"出现, 大暴雨, 山区, 夜间, 山洪"
361,2,北京市 气象台 升级 发布 最高级别 暴雨 红色 预警 信号 预计 夜间 夜间 本市 出现 大暴雨 西部 南部 大暴雨 主要 降雨 过程 出现 时至 全市 大暴雨 房山 门头沟 昌平 海淀 石景山 丰台 延庆 大兴 通州 西城 东城 朝阳 部分 地区 有特 大暴雨 山区 山区 出现 强降水 诱发 中小 河流 洪水 山洪 地质灾害 次生 灾害 风险 较大 城市 低洼地区 容易 出现 积水 注意 防范 北京日报,"出现, 大暴雨, 山区, 夜间, 山洪"
362,12,暴雨 突如其来 北京市 气象局 消息 预计 夜间 夜间 本市 出现 大暴雨 西部 南部 大暴雨 主要 降雨 过程 出现 时至 全市 大暴雨 房山 门头沟 昌平 海淀 石景山 丰台 延庆 大兴 通州 西城 东城 朝阳 部分 地区 有特 大暴雨 台风 杜苏芮 停止 编号 导致 千里 之外 京津冀 极端 强降雨 中央气象台 首席 预报员 方翀 中央气象台 高级 工程师 胡宁用 一张 解释 下图 引导 北上 杜苏芮 登陆 位于 东侧 呈现出 一种 接近 方形 形态 西侧 南风 气流 引导 杜苏芮 残余 环流 一路 北上 继续 播洒 降水 高压脊 横亘 阻挡 杜苏芮 残余 环流 停滞 华北 不断 向北 移动 大气 环流 形势 发生变化 西部 高压脊 互相 连通 形成 高压 横亘 杜苏芮 残余 环流 北方 陆地 摩擦 影响 已经 元气大伤 杜苏芮 无力 冲破 前方 高压 阻拦 只得 华北地区 放慢 脚步 急流 输水 杜苏芮 残余 环流 东北侧 之间 形成 一条 急流 水汽 源源不断 海上 输送到 华北地区 持续 降水 提供 充足 原材料 地形 抬升 急流 遇到 太行山 燕山 地形 被迫 抬升 有利于 水汽 凝结 成雨 进一步 强降水 一臂之力 大气 环流 形势 地形 因素 共同 作用 杜苏芮 残余 环流 得以 深入 我国 北方 数日 遥远 华北地区 继续 制造 极端 暴雨 需要 注意 上述 因素 并非 依次 就位 共同 作用,"北京, 暴雨, 降雨, 大暴雨, 影响"
363,12,这场 雨有 猛烈 多久 北京市 气象台 发布 暴雨 红色 预警 信号 详情 中国气象局 消息 预计 夜间 北京 出现 暴雨 大暴雨 局地 大暴雨 目前 北京市 防汛 指挥部 启动 全市 防汛 橙色 二级 预警 响应 这场 雨有 猛烈 多久 防御 北京市 气象台 首席 预报员 赵玮张 琳娜 北京市 气象 服务中心 服务 首席 尤焕苓 这场 进行 全面 解读 一问 暴雨 持续 多久 此次 降雨 过程 持续 影响 预计 夜间 北京 暴雨 大暴雨 局地 大暴雨 降雨 过程 阵风 可达 左右 此次 降雨 分为 三个 阶段 类似 列车 先后 影响 北京 第一阶段 列车 夜间 杜苏芮 消散 热带 低压 外围 降水 云系 影响 北京 大雨 西南部 地区 暴雨 伴有 雷电 短时 强降水 短时 大风 第二阶段 好似 列车 车厢 白天 早晨 热带 低压 主体 云系 到来 北京 将会 出现 暴雨 大暴雨 局地 大暴雨 此次 过程 降水量 最为 集中 最大 时段 西部 南部 地区 降水量 相对 较大 降雨 期间 东风 阵风 降雨 具有 间歇性 第三阶段 收尾 阶段 白天 北京 小到中雨 此次 过程 趋于 结束 二问 暴雨 强度 是否 突破 历史纪录 此次 降雨 过程 持续时间 累计 雨量 具有 一定 极端 特别 白天 早晨 第二阶段 北京 降雨 最强 时段 此时 降水量 将会 达到 暴雨 大暴雨 量级 西南部 地区 达到 大暴雨 量级 小时 降水量 累计 降水量 很大 致灾 风险 目前 监测 来看 此次 天气 过程 水汽 十分 充足 持续时间 较长 东风 地形 结合 叠加 降雨 明显 增幅 作用 综合 研判 此次 降水 过程 极端 可能 突破 历史纪录 一定 注意 防范 三问 地区 需要 特别 关注 北京 西南部 包括 门头沟 房山 海淀 西部 需要 尤其 关注 北京 此次 降水 主要 台风 减弱 低压 副热带 高压 外围 暖湿气流 共同 影响 二者 结合 位置 北京 西南部 北部 燕山 西部 太行山 余脉 地形 因素 北京 西南部 降水 一定 增幅 作用 降水量 可能 达到 大暴雨 毫米 以上 量级 可能 出现 三天 累计 降水量 毫米 情况 西南部 山区 强降水 诱发 中小 河流 洪水 山洪 地质灾害 次生 灾害 风险 较大 需要 高度 警惕 四问 北京 台风 影响 情况 多见 总体 来说 不多见 据统计 自有 气象 记录 以来 台风 减弱 低压 接近 北京 北京地区 带来 比较 明显 风雨 影响 影响 最大 一次 浙江 登陆 台风 温黛 北京 带来 较大 降水 当时 全市 观测站 平均 降水量 超过 毫米 五问 应对 暴雨 此次 降雨 过程 全市 居民 出行 工作 生活 带来 比较 影响 关注 最新 降雨 实况 预报 预警 信息 风雨 期间 最好 出门 居家 关紧 门窗 老旧 房屋 提前 做好 防漏 苫盖 修缮 工作 加强 房屋 稳固 情况 进行 检查 发现 存在 安全隐患 尽快 撤离 安全 地方 暴雨 造成 山洪 山体 崩塌 泥石流 地质灾害 风险 增大 市民 应当 避免 前往 山区 河道 地质灾害 隐患 区域 活动 山区 居民 提前 转移 安全 区域 六问 北京市 气象部门 举措 应对 此次 降雨 过程 北京市 气象局 进入 特别 工作 状态 一级 应急 响应 坚持 人民 至上 生命 至上 主要 负责人 小时 带班 强化 底线 思维 极限 思维 提前 开展 观测 设备 巡检 维护 注重 发挥 科技成果 预报 预警 支撑 作用 全方位 开展 面向 公众 科普 宣传 举办 新闻 通气会 录制 台风 影响 防御 解读 方式 全网 发布 暴雨 提示信息 台风 强降水 科普知识 针对 行业 用户 日起 铁路部门 发布 专报 警报 交通委 交管局 排水 集团 单位 滚动 发布 专项 预报 预警 信息 加强 电力 城市 应急 旅游 领域 跟踪服务 提前 做出 重要 提示 京报,"北京, 暴雨, 降雨, 大暴雨, 影响"
364,36,北京 发布 洪水 蓝色 预警 防汛 提示 水文 总站 发布 洪水 蓝色 预警 气象预报 日至 我市 暴雨 大暴雨 过程 预测 分析 大清河 流域 拒马河 北运河 流域 温榆河 永定河 流域 永定河 可能 发生 蓝色 预警 等级 洪水 市民 远离 河道,"洪水, 流域, 预警, 蓝色, 永定河"
365,18,暴雨 红色 升级 发布 朝阳区 气象台 升级 发布 暴雨 红色 预警 信号 预计 夜间 夜间 朝阳区 出现 大暴雨 局地 大暴雨 主要 降雨 过程 出现 时至 强降水 诱发 中小 河流 洪水 次生 灾害 风险 较大 城市 低洼地区 容易 出现 积水 注意 防范,"出现, 大暴雨, 暴雨, 夜间, 预警"
366,2,北京市 气象台 升级 发布 最高级别 暴雨 红色 预警 信号 预计 夜间 夜间 本市 出现 大暴雨 西部 南部 大暴雨 主要 降雨 过程 出现 时至 全市 大暴雨 房山 门头沟 昌平 海淀 石景山 丰台 延庆 大兴 通州 西城 东城 朝阳 部分 地区 有特 大暴雨 山区 山区 出现 强降水 诱发 中小 河流 洪水 山洪 地质灾害 次生 灾害 风险 较大 城市 低洼地区 容易 出现 积水 注意 防范 编辑 昊昊,"出现, 大暴雨, 山区, 夜间, 山洪"
367,4,北京 全市 河湖 区域 全面 停航 北京 发布 山洪 城市 内涝 洪水 风险 提示 北京市 水务局 气象局 今天 联合 发布 山洪 城市 内涝 洪水 风险 提示 此前 防洪 应急 响应 升级 防洪 二级 应急 响应 北京市 水务局 要求 日前 全市 河湖 区域 全面 停航 船只 全部 靠岸 停泊 全面 封控 下河 道路 涉河 工程 全部 停工 人员 设备 提前 撤离 城市 河湖 水系 已于 提前 水位 降至 汛期 运行 水位 以下,"北京, 洪水, 发布, 防洪, 内涝"
368,2,北京 升级 发布 最高级别 暴雨 红色 预警 全市 大暴雨 北京市 气象台 升级 发布 最高级别 暴雨 红色 预警 信号 预计 夜间 夜间 本市 出现 大暴雨 西部 南部 大暴雨 主要 降雨 过程 出现 时至 全市 大暴雨 房山 门头沟 昌平 海淀 石景山 丰台 延庆 大兴 通州 西城 东城 朝阳 部分 地区 有特 大暴雨 山区 山区 出现 强降水 诱发 中小 河流 洪水 山洪 地质灾害 次生 灾害 风险 较大 城市 低洼地区 容易 出现 积水 注意 防范 北京,"出现, 大暴雨, 山区, 夜间, 山洪"
369,36,北京 发布 洪水 蓝色 预警 防汛 提示 水文 总站 发布 洪水 蓝色 预警 气象预报 日至 我市 暴雨 大暴雨 过程 预测 分析 大清河 流域 拒马河 北运河 流域 温榆河 永定河 流域 永定河 可能 发生 蓝色 预警 等级 洪水 市民 远离 河道 确保 安全,"洪水, 流域, 预警, 蓝色, 永定河"
370,36,防汛 提示 水文 总站 发布 洪水 蓝色 预警 气象预报 日至 我市 暴雨 大暴雨 过程 预测 分析 大清河 流域 拒马河 北运河 流域 温榆河 永定河 流域 永定河 可能 发生 蓝色 预警 等级 洪水 市民 远离 河道 确保 安全,"洪水, 流域, 预警, 蓝色, 永定河"
371,12,日至 京津冀 部分 地区 累计 降水量 达到 毫米 局地 累计 降水量 可达 毫米 以上 中央气象台 首席 预报员 方翀 中央气象台 台风 海洋 气象预报 中心 高级 工程师 黄奕 中国气象局 公共 气象 服务中心 服务 首席 王秀荣 最新 解读 列车 效应 京津冀 地区 这次 过程 属于 长时间 固定 天气 系统 影响 如人 一节 列车 面前 接连不断 感受 一节 节车厢 带来 巨大 声音 冲力 影响 效果 叠加 导致 灾害 效应 加剧 称作 列车 效应 式微 台风 这种 威力 杜苏芮 停编 导致 列车 效应 高压 拦截 导致 杜苏芮 华北 黄淮 一带 停留时间 增长 携带 大量 水汽 台风 卡努 远距离 输水 双线 并存 太行山 燕山 地形 抬升 历史 有无 前例 台风 莎莉 福建 登陆 途经 江西 湖北 进入 河南 北边 形成 高压 导致 京津冀 地区 强降雨 当时 累计 降水量 毫米 以上 造成 沿途 地区 大风 暴雨 具体 防范 建议 尽量减少 外出 避免 洪涝 区域 停留 必须 车辆 出行 绕开 气象 灾害 风险 路段 避免 涉水 城镇 低洼地区 偏远 山区 确保 排水 畅通 户外 避雨 注意 防范 雷击 做好 应急 物资 储备 中国气象局,"北京, 暴雨, 降雨, 大暴雨, 影响"
372,12,这场 雨有 猛烈 多久 北京市 气象台 发布 暴雨 红色 预警 信号 详情 中国气象局 消息 预计 夜间 北京 出现 暴雨 大暴雨 局地 大暴雨 目前 北京市 防汛 指挥部 启动 全市 防汛 橙色 二级 预警 响应 这场 雨有 猛烈 多久 防御 北京市 气象台 首席 预报员 赵玮张 琳娜 北京市 气象 服务中心 服务 首席 尤焕苓 这场 进行 全面 解读 一问 暴雨 持续 多久 此次 降雨 过程 持续 影响 预计 夜间 北京 暴雨 大暴雨 局地 大暴雨 降雨 过程 阵风 可达 左右 此次 降雨 分为 三个 阶段 类似 列车 先后 影响 北京 第一阶段 列车 夜间 杜苏芮 消散 热带 低压 外围 降水 云系 影响 北京 大雨 西南部 地区 暴雨 伴有 雷电 短时 强降水 短时 大风 第二阶段 好似 列车 车厢 白天 早晨 热带 低压 主体 云系 到来 北京 将会 出现 暴雨 大暴雨 局地 大暴雨 此次 过程 降水量 最为 集中 最大 时段 西部 南部 地区 降水量 相对 较大 降雨 期间 东风 阵风 降雨 具有 间歇性 第三阶段 收尾 阶段 白天 北京 小到中雨 此次 过程 趋于 结束 二问 暴雨 强度 是否 突破 历史纪录 此次 降雨 过程 持续时间 累计 雨量 具有 一定 极端 特别 白天 早晨 第二阶段 北京 降雨 最强 时段 此时 降水量 将会 达到 暴雨 大暴雨 量级 西南部 地区 达到 大暴雨 量级 小时 降水量 累计 降水量 很大 致灾 风险 目前 监测 来看 此次 天气 过程 水汽 十分 充足 持续时间 较长 东风 地形 结合 叠加 降雨 明显 增幅 作用 综合 研判 此次 降水 过程 极端 可能 突破 历史纪录 一定 注意 防范 三问 地区 需要 特别 关注 北京 西南部 包括 门头沟 房山 海淀 西部 需要 尤其 关注 北京 此次 降水 主要 台风 减弱 低压 副热带 高压 外围 暖湿气流 共同 影响 二者 结合 位置 北京 西南部 北部 燕山 西部 太行山 余脉 地形 因素 北京 西南部 降水 一定 增幅 作用 降水量 可能 达到 大暴雨 毫米 以上 量级 可能 出现 三天 累计 降水量 毫米 情况 西南部 山区 强降水 诱发 中小 河流 洪水 山洪 地质灾害 次生 灾害 风险 较大 需要 高度 警惕 四问 北京 台风 影响 情况 多见 总体 来说 不多见 据统计 自有 气象 记录 以来 台风 减弱 低压 接近 北京 北京地区 带来 比较 明显 风雨 影响 影响 最大 一次 浙江 登陆 台风 温黛 北京 带来 较大 降水 当时 全市 观测站 平均 降水量 超过 毫米 五问 应对 暴雨 此次 降雨 过程 全市 居民 出行 工作 生活 带来 比较 影响 关注 最新 降雨 实况 预报 预警 信息 风雨 期间 最好 出门 居家 关紧 门窗 老旧 房屋 提前 做好 防漏 苫盖 修缮 工作 加强 房屋 稳固 情况 进行 检查 发现 存在 安全隐患 尽快 撤离 安全 地方 暴雨 造成 山洪 山体 崩塌 泥石流 地质灾害 风险 增大 市民 应当 避免 前往 山区 河道 地质灾害 隐患 区域 活动 山区 居民 提前 转移 安全 区域 六问 北京市 气象部门 举措 应对 此次 降雨 过程 北京市 气象局 进入 特别 工作 状态 一级 应急 响应 坚持 人民 至上 生命 至上 主要 负责人 小时 带班 强化 底线 思维 极限 思维 提前 开展 观测 设备 巡检 维护 注重 发挥 科技成果 预报 预警 支撑 作用 全方位 开展 面向 公众 科普 宣传 举办 新闻 通气会 录制 台风 影响 防御 解读 方式 全网 发布 暴雨 提示信息 台风 强降水 科普知识 针对 行业 用户 日起 铁路部门 发布 专报 警报 交通委 交管局 排水 集团 单位 滚动 发布 专项 预报 预警 信息 加强 电力 城市 应急 旅游 领域 跟踪服务 提前 做出 重要 提示 京报,"北京, 暴雨, 降雨, 大暴雨, 影响"
373,2,预计 夜间 夜间 本市 出现 大暴雨 西部 南部 大暴雨 主要 降雨 过程 出现 时至 全市 大暴雨 房山 门头沟 昌平 海淀 石景山 丰台 延庆 大兴 通州 西城 东城 朝阳 部分 地区 有特 大暴雨 山区 山区 出现 强降水 诱发 中小 河流 洪水 山洪 地质灾害 次生 灾害 风险 较大 城市 低洼地区 容易 出现 积水 注意 防范,"出现, 大暴雨, 山区, 夜间, 山洪"
374,12,这场 雨有 猛烈 多久 北京市 气象台 发布 暴雨 红色 预警 信号 详情 中国气象局 消息 预计 夜间 北京 出现 暴雨 大暴雨 局地 大暴雨 目前 北京市 防汛 指挥部 启动 全市 防汛 橙色 二级 预警 响应 这场 雨有 猛烈 多久 防御 北京市 气象台 首席 预报员 赵玮张 琳娜 北京市 气象 服务中心 服务 首席 尤焕苓 这场 进行 全面 解读 一问 暴雨 持续 多久 此次 降雨 过程 持续 影响 预计 夜间 北京 暴雨 大暴雨 局地 大暴雨 降雨 过程 阵风 可达 左右 此次 降雨 分为 三个 阶段 类似 列车 先后 影响 北京 第一阶段 列车 夜间 杜苏芮 消散 热带 低压 外围 降水 云系 影响 北京 大雨 西南部 地区 暴雨 伴有 雷电 短时 强降水 短时 大风 第二阶段 好似 列车 车厢 白天 早晨 热带 低压 主体 云系 到来 北京 将会 出现 暴雨 大暴雨 局地 大暴雨 此次 过程 降水量 最为 集中 最大 时段 西部 南部 地区 降水量 相对 较大 降雨 期间 东风 阵风 降雨 具有 间歇性 第三阶段 收尾 阶段 白天 北京 小到中雨 此次 过程 趋于 结束 二问 暴雨 强度 是否 突破 历史纪录 此次 降雨 过程 持续时间 累计 雨量 具有 一定 极端 特别 白天 早晨 第二阶段 北京 降雨 最强 时段 此时 降水量 将会 达到 暴雨 大暴雨 量级 西南部 地区 达到 大暴雨 量级 小时 降水量 累计 降水量 很大 致灾 风险 目前 监测 来看 此次 天气 过程 水汽 十分 充足 持续时间 较长 东风 地形 结合 叠加 降雨 明显 增幅 作用 综合 研判 此次 降水 过程 极端 可能 突破 历史纪录 一定 注意 防范 三问 地区 需要 特别 关注 北京 西南部 包括 门头沟 房山 海淀 西部 需要 尤其 关注 北京 此次 降水 主要 台风 减弱 低压 副热带 高压 外围 暖湿气流 共同 影响 二者 结合 位置 北京 西南部 北部 燕山 西部 太行山 余脉 地形 因素 北京 西南部 降水 一定 增幅 作用 降水量 可能 达到 大暴雨 毫米 以上 量级 可能 出现 三天 累计 降水量 毫米 情况 西南部 山区 强降水 诱发 中小 河流 洪水 山洪 地质灾害 次生 灾害 风险 较大 需要 高度 警惕 四问 北京 台风 影响 情况 多见 总体 来说 不多见 据统计 自有 气象 记录 以来 台风 减弱 低压 接近 北京 北京地区 带来 比较 明显 风雨 影响 影响 最大 一次 浙江 登陆 台风 温黛 北京 带来 较大 降水 当时 全市 观测站 平均 降水量 超过 毫米 五问 应对 暴雨 此次 降雨 过程 全市 居民 出行 工作 生活 带来 比较 影响 关注 最新 降雨 实况 预报 预警 信息 风雨 期间 最好 出门 居家 关紧 门窗 老旧 房屋 提前 做好 防漏 苫盖 修缮 工作 加强 房屋 稳固 情况 进行 检查 发现 存在 安全隐患 尽快 撤离 安全 地方 暴雨 造成 山洪 山体 崩塌 泥石流 地质灾害 风险 增大 市民 应当 避免 前往 山区 河道 地质灾害 隐患 区域 活动 山区 居民 提前 转移 安全 区域 六问 北京市 气象部门 举措 应对 此次 降雨 过程 北京市 气象局 进入 特别 工作 状态 一级 应急 响应 坚持 人民 至上 生命 至上 主要 负责人 小时 带班 强化 底线 思维 极限 思维 提前 开展 观测 设备 巡检 维护 注重 发挥 科技成果 预报 预警 支撑 作用 全方位 开展 面向 公众 科普 宣传 举办 新闻 通气会 录制 台风 影响 防御 解读 方式 全网 发布 暴雨 提示信息 台风 强降水 科普知识 针对 行业 用户 日起 铁路部门 发布 专报 警报 交通委 交管局 排水 集团 单位 滚动 发布 专项 预报 预警 信息 加强 电力 城市 应急 旅游 领域 跟踪服务 提前 做出 重要 提示 京报,"北京, 暴雨, 降雨, 大暴雨, 影响"
375,35,华为 浏览器 北京 发布 洪水 蓝色 预警,"北京, 洪水, 预警, 发布, 蓝色"
