Document_ID,Topic,Text,Top_Keywords
737,29,水利部 重要 汛情 通报 显示 目前 水利部 维持 北京 天津 河北 山西 山东 河南 福建 广东 洪水 防御 应急 响应 浙江 安徽 江西 湖北 洪水 防御 应急 响应 水利部 工作组 分别 北京 天津 河北 山西 河南 浙江 安徽 福建 江西 湖北 广东 重庆 四川 南水北调 中线 工程 协助 指导 地方 做好 台风 暴雨 防御 工作 水利部 滚动 分析 研判 台风 杜苏芮 行进 路径 雨情 水情 汛情 发展 安排 部署 台风 强降雨 洪水 防御 工作 北京 天津 河北 山西 辽宁 黑龙江 江苏 浙江 安徽 福建 江西 山东 河南 直辖市 发出 一省 一单 提醒 做好 暴雨 洪水 防范 应对 工作 预计 时至 杜苏芮 北上 冷空气 共同 影响 华北 大部 黄淮 中部 江淮 中部 江西 北部 福建 北部 东部 浙江 南部 辽宁 东部 大到暴雨 河北 西部 南部 山西 东部 部分 地区 大暴雨 大暴雨 受其 影响 预计 太湖流域 闽江 上游 钱塘江 上游 瓯江 长江流域 鄱阳湖 水系 信江 饶河 江西 安徽 沿江 支流 淮河 中游 干支流 及沂 沭河 水系 黄河 下游 大汶河 海河 流域 漳卫河 上游 子牙河 滏阳 滹沱河 上游 大清河 上游 河流 出现 明显 涨水 过程 暴雨 区内 中小 河流 可能 发生 超警 洪水 水利部 密切 关注 杜苏芮 演进 强降雨 过程 加强 预报 预警 滚动 会商 研判 科学 调度 工程 拦蓄 洪水 暴雨 洪水 情况 适时 增派 工作组 指导 地方 做好 监测 预报 预警 工程 调度 水库 安全 度汛 中小 河流 洪水 山洪 灾害 防御 工作 全力 保障 防洪 安全 新华社,"洪水, 应急, 防御, 工作, 做好"
738,-1,红桥 雨情 通报 大到暴雨 时至 我区 平均 降雨量 毫米 洛川 毫米 春园 毫米 潞河 毫米 目前 全区 平均 降雨量 超过 毫米 个别 观测点 达到 暴雨 级别 依据 国家 气象局 颁布 降水强度 等级 划分 标准 小雨 降雨量 小于 中雨 降雨量 大雨 降雨量 暴雨 降雨量 大暴雨 降雨量 大暴雨 降雨量 以上者 今日 中央气象台 继续 发布 暴雨 红色 预警 强对流 天气 黄色 预警 水利部 发布 海河 流域 洪水 黄色 预警 气象专家 提醒 过去 一天 北京 天津 河北 河南 山东 山西 已经 出现 强降雨 预计 今明两天 上述 地区 降雨 仍会 持续 雨水 不断 叠加 致灾 风险 公众 提高警惕 不要 前往 山区 地质灾害 易发 路遇 积水 不要 贸然 涉水 保障 安全 天津市 气象台 今早 发布 市区 今天上午 暴雨 下午 夜间 大雨 东南风 阵风 东风 阵风 今天 白天 最高 气温 夜间 最低气温 相对湿度 天津 进入 核心 降雨 时段 昨天 时到 今天 全市 降雨 平均 降雨量 毫米 最大 降雨量 毫米 出现 滨海新区 南港 港池 最大 小时 降雨量 毫米 出现 海区 台头 中心 城区 降雨 平均 降雨量 毫米 最大 降雨量 毫米 出现 河西区 恒山 次大 降雨量 毫米 出现 河西区 汉江 遇到 暴雨 应该 记住 提高 个人 防范 意识 近日 我国 多地 出现 短时 强降水 雷暴 大风 强对流 天气 常常 听到 小时 降水量 毫米 注意 暴雨 类似 预报 信息 毫米 厘米 暴雨 量级 起来 看看 红桥 雨情 通报 大到暴雨 了解 综合 防汛 抗旱 指挥部 津云,异常值
739,29,防办 启动 防洪 应急 响应 紧急通知 区防指 成员 单位 各分部 工作组 各乡镇 街道 气象部门 预报 日至 我区 持续性 强降雨 过程 主要 降雨 时段 后半夜 日至 白天 过程 累计 降雨量 毫米 部分 地区 毫米 局地 可达 毫米 最大 小时 降雨量 毫米 水利部 海委 水文 预报 三河 永定河 大清河 子牙河 洪水 下泄 防办 已于 分将市 防洪 应急 响应 升级 为市 防洪 应急 响应 天津市 海区 防汛 抗旱 应急 预案 规定 防办 综合 会商 研判 决定 分将区 防洪 应急 响应 升级 为区 防洪 应急 响应 区防指 指挥 区防指 农村 分部 城区 分部 指挥 区防指 工作组 组长 人武部 消防 救援 支队 水务局 等区 防指 成员 单位 组织 本组 部门 相关 人员 上岗 到位 气象 组要 密切 关注 天气 变化 每日 至少 发布 气象 信息 水情 调度 做好 我区 主要 行洪 河道 调度 运行 工作 河道 水情 适时 提出 加测 加报 水文 断面 适时 提出 农村 排沥限禁 排蓄 滞洪区 启用 准备 调度 综合 建议 及时 反馈 相关 单位 乡镇 街道 园区 防汛 调度 指令 落实 情况 抢险 需要 组织 区级 防汛 抗旱 应急 救援 队伍 执行 抢险救灾 任务 险情 灾情 提出 物资 需求 建议 转移 安置 组要 做好 受灾 群众 安置 转移 工作 做好 安置 群众 所需 救灾物资 设备 调拨 发放 物资 组要 做好 调运 防汛 物资 准备 通讯 组织 指导 通讯 运营 企业 开展 通信 保障 工作 保卫组 抢险救灾 物资 运输 路线 组织 做好 沿线 道路交通 秩序 保障 确保 抢险救灾 物资 及时 到位 做好 抢险救灾 现场 安全 警戒 人员 车辆 疏导 交通运输 组要 筹划 集结 防汛 抗旱 抢险救灾 行动 所需 运输 车辆 随时 执行 交通运输 任务 生活 保障 做好 防汛 应急 队伍 转移 安置 群众 生活 保障 准备 信息 宣传组 适时 组织 召开 新闻 商会 媒体 通报 雨水 工作 情况 组织 新闻媒体 全区 洪水 内涝 应对 处置 工作 相关 情况 进行 宣传报道 区住 建委 组织 做好 在建 工程 适时 停工 指导 各乡镇 街道 做好 危陋 房屋 群众 避险 转移 安置工作 区城 管委 加强 户外 广告牌 搭建 防风 加固 交通局 开展 道路 损毁 路段 应急 抢修 商务局 组织 做好 生活必需品 市场供应 工作 电力公司 组织 做好 防汛 抢险救灾 电力 保障 工作 人武部 消防 救援 支队 组织 做好 参加 防汛 抢险救灾 准备 区防指 成员 单位 各乡镇 街道 园区 预案 做好 防汛 抢险救灾 准备 保障 工作 区防指 各分部 预案 各分部 指挥部 办公室 位置 上岗 做好 防汛 抢险救灾 准备 保障 工作 海区 防汛 抗旱 指挥部 办公室,"洪水, 应急, 防御, 工作, 做好"
740,26,注意安全,"注意安全, 安全, 话筒, 平安, 晚安"
741,26,危难 面前 真章,"注意安全, 安全, 话筒, 平安, 晚安"
742,29,北京市 农业 农村 提示 全力 抓好 农业 生产 防汛 各项 工作 结合 本市 农业 生产 特点 北京市 农业 农村 今天 发布 提示 落实 各项 应对 措施 基础 当前 突出 抓好 种植业 养殖业 农保 理赔 方面 重点 工作 北京市 农业 农村 迅速 贯彻落实 市委 市政府 防汛 工作 相关 部署 安排 采取 专题 调度 实地 指导 预警 提示 形式 督导 涉农 各类 服务 对象 认真落实 相关 具体 要求 紧密结合 实际 情况 做到 充分准备 细致 防范 全力 抓好 各项 应对 工作 北京市 农业 农村 提示 种植业 方面 提前 疏浚 排水 沟渠 备好 排水 设备 及时 排除 农田 渍涝 积水 二要 及时 加固 老旧 设施 人员 提前 撤离 农业 设施 雨后 抢排 积水 清理 棚内 残留物 三是 如有 受涝 田块 排涝 后要 及时 中耕 追肥 防治 病虫草害 促进 作物 恢复 生长 损害 严重 地块 及时 补种 养殖业 方面 所有 地势 低洼 养殖场 临山 临水 畜禽 水产 养殖场 人员 一定 提前 撤离 安全 场所 避免 洪水 山体 滑坡 泥石流 突发 灾害 导致 人员伤亡 农保 理赔 方面 已经 参加 政策性 农业 保险 农户 出现 受灾 情况 迅速 相关 保险公司 联系 及时 报告 受灾 情况 北京 新闻广播 唐思萌,"洪水, 应急, 防御, 工作, 做好"
743,-1,七点 多醒 超话 看到 很多 户户 暴雨 北京 搜上 故宫 闭馆 暴雨 预警 消息 继续 回笼觉 梦见 一场 暴雨 洪水 瞬间 低洼 体育馆 淹没 拼命 往上爬 梦醒 之后 发现 演唱会 已经 取消,异常值
744,36,目击者 救出 河北 衡水 男子 驾驶 越野车 渡河 车子 进入 河道 水流 冲走 目击者 李先生 当时 看到 这辆 车想 渡河 对岸 河水 水流 急车 河道 深处 幸好 河底 石头 营救 赢得 时间 随后 有人 进入 河道 车主 救援 上岸 衡水 点时 新闻,"洪水, 流域, 预警, 蓝色, 永定河"
745,-1,天津市 水务 部门 全力 应对 台风 强降雨 从市 水务局 获悉 台风 杜苏芮 影响 日至 我市 海河 流域 出现 强降雨 过程 时至 全市 平均 降雨 毫米 最大 降雨 毫米 出现 滨海新区 南港 港池 中心 城区 降雨 平均 降雨 毫米 最大 降雨 毫米 出现 河西区 汉江 流域 水文 测报 预计 三河 北运河 潮白河 蓟运河 永定河 系及 大清河 洪水 过境 确保 我市 防汛 安全 水务 部门 启动 洪涝灾害 防御 应急 响应 紧急 采取 应对 措施 全力 做好 台风 强降雨 防御 工作,异常值
746,-1,天津市 水务 部门 全力 应对 台风 强降雨 从市 水务局 获悉 台风 杜苏芮 影响 日至 我市 海河 流域 出现 强降雨 过程 时至 全市 平均 降雨 毫米 最大 降雨 毫米 出现 滨海新区 南港 港池 中心 城区 降雨 平均 降雨 毫米 最大 降雨 毫米 出现 河西区 汉江 流域 水文 测报 预计 三河 北运河 潮白河 蓟运河 永定河 系及 大清河 洪水 过境 确保 我市 防汛 安全 水务 部门 启动 洪涝灾害 防御 应急 响应 紧急 采取 应对 措施 全力 做好 台风 强降雨 防御 工作,异常值
747,12,未来 小时 北京 降雨 由南向北 逐渐 加强 收好 这份 避险 自救 指南 北京市 气象台 发布 雨量 跟踪 时至 北京地区 全市 平均 降雨量 毫米 城区 平均 毫米 最大 降雨 出现 房山 流水 毫米 最大 小时 雨强 出现 顺义 石槽 降雨量 毫米 目前 降水 雨势 相对 平缓 预计 未来 小时 本市 降雨 由南向北 逐渐 加强 最大 小时 雨强 毫米 据市 气象台 最新 发布 天气预报 今天下午 暴雨 大暴雨 东风 四级 阵风 七级 左右 最高 气温 夜间 暴雨 西部 南部 大暴雨 东风 四级 阵风 七级 左右 最低气温 暴雨 红色 雷电 黄色 大风 蓝色 预警 今天 日本 市有 大暴雨 西部 南部 城区 有特 大暴雨 局地 强大 出行 注意 防风 防雨 交通安全 山区 防范 地质灾害 夏季 暴雨 多发 收到 暴雨 预警 做好 防护 紧急 时有 注意事项 雨天 出行 防范 城市 内涝 突发 洪水 快收 这份 暴雨 避险 自救 指南 北京市 防汛 指挥部 提醒 广大 市民 非必要 外出,"北京, 暴雨, 降雨, 大暴雨, 影响"
748,24,超强 台风 天气 反转 福州 厦门 北开 南京 南开 停运 南京 南开 改为 福州 终到 福州 厦门 停运 厦门 停运 停运 厦门 杭州 东开 停运 厦门 北开 宁波 停运 厦门 福州 厦门 停运 福州 厦门 福州 厦门 福州 停运 南昌 西开 厦门 停运 福州 赣州 厦门 赣州 停运 瑞金 赣州 厦门 赣州 停运 福州 南开 平潭 赣州 平潭 停运 赣州 改为 福州 终到 福州 南至 平潭 停运 平潭 停运 九江 次改 南丰 终到 南丰 厦门 停运 厦门 停运 南昌 西开 厦门 停运 南昌 西开 次改 福州 终到 福州 平潭 停运 平潭 改为 福州 始发 平潭 福州 停运 平潭 福州 停运 南昌 西开 厦门 停运 龙岩 福鼎 赣州 停运 瑞金 赣州 福州 赣州 停运 龙岩 赣州 福鼎 停运 龙岩 福鼎 停运 龙岩 福州 停运 龙岩 平潭 停运 平潭 福州 停运 福州 厦门 福州 厦门 停运 泰宁 改为 福州 终到 福州 厦门 停运 厦门 福州 厦门 停运 福州 广州 南开 停运 北京 南开 改为 福州 终到 福州 厦门 停运 厦门 北开 改为 福州 始发 福州 调整 厦门 北至 福州 停运 厦门 武汉 停运 厦门 北开 停运 厦门 重庆 北开 停运 厦门 昆明 南开 停运 福州 南开 南平市 南宁 东开 南平市 停运 龙岩 上海 虹桥 停运 龙岩 福州 停运 厦门 上海 虹桥 停运 厦门 南平市 停运 厦门 北开 杭州 西开 停运 厦门 改为 福州 始发 厦门 福州 停运 上海 虹桥 改为 福州 终到 厦门 北开 上海 虹桥 南平市 上海 虹桥 停运 厦门 杭州 东开 停运 龙岩 改为 福州 始发 龙岩 福州 停运 上海 虹桥 改为 福州 终到 福州 南至 龙岩 停运 龙岩 南京 南开 停运 福州 南开 深圳 北开 上饶 深圳 北开 停运 福州 香港 西九龙 停运 厦门 香港 西九龙 停运 南昌 西开 广州 东开 停运 汕头 潮汕 广州 东开 停运 福州 南开 深圳 北开 停运 福州 南开 东莞 南开 泰宁 深圳 北开 停运 龙岩 深圳 北开 赣州 停运 瑞金 赣州 深圳 北开 停运 厦门 北开 诏安 南平市 诏安 停运 停运 龙岩 停运 停运 南昌 西开 九江 厦门 北开 九江 停运 南昌 西开 厦门 停运 长沙 南开 改为 福州 终到 福州 厦门 停运 厦门 改为 福州 始发 厦门 福州 停运 福州 南开 平潭 停运 福州 南开 平潭 停运 平潭 改为 福州 始发 平潭 福州 停运 上海 虹桥 改为 福州 南站 终到 福州 南至 平潭 停运 上海 虹桥 改为 福州 终到 福州 南至 莆田 停运 莆田 改为 福州 始发 莆田 福州 停运 长沙 南开 厦门 北开 停运 广州 南开 福州 南开 停运 深圳 北开 厦门 停运 香港 西九龙 厦门 停运 日至 深圳 北开 厦门 香港 西九龙 停运 日至 厦门 广州 东开 停运 日至 深圳 北开 福州 南开 停运 深圳 北开 厦门 厦门 北开 停运 日至 深圳 北开 停运 日至 南京 南开 停运 日至 深圳 北开 厦门 北开 厦门 停运 日至 广州 东开 停运 日至 台州 停运 深圳 北开 停运 莆田 停运 梅州 西开 厦门 深圳 北开 停运 日至 深圳 北开 厦门 停运 日至 广州 东开 厦门 深圳 北开 停运 日至 厦门 北开 东莞 南开 厦门 停运 广州 东开 福州 南开 停运 深圳 北开 福州 南开 停运 武汉 梅州 西开 停运 南宁 东开 停运 厦门 北开 停运 深圳 北开 厦门 停运 厦门 深圳 北开 福州 南开 深圳 北开 停运 深圳 北开 厦门 北开 停运 昆明 南开 厦门 北开 停运 西安 北开 厦门 北开 泉州 厦门 北开 停运 北京 南开 厦门 北开 停运 成都 东开 厦门 北开 停运 青岛 厦门 停运 天津 西开 厦门 北开 停运 郑州 东开 厦门 北开 停运 贵阳 北开 厦门 北开 停运 北京 南开 厦门 北开 停运 重庆 北开 厦门 北开 停运 普速 列车 调整 方案 北京 丰台 停运 厦门 北开 停运 日至 厦门 北开 日至 上海 南开 停运 重庆 西开 厦门 北开 停运 厦门 北开 重庆 西开 停运 贵阳 停运 厦门 北开 北京 丰台 改为 赣州 终到 赣州 厦门 停运 厦门 北开 改为 赣州 始发 厦门 北至 赣州 停运 兰州 次改 三明 终止 三明 北至 厦门 停运 厦门 北开 次改 三明 始发 厦门 北至 三明 停运 西安 厦门 北开 停运 郑州 停运 厦门 北开 停运 太原 改为 南昌 终到 南昌 厦门 停运 厦门 北开 改为 南昌 始发 厦门 北至 南昌 停运 长春 改为 南昌 终到 南昌 厦门 停运 厦门 北开 改为 南昌 始发 厦门 北至 南昌 停运 购买 停运 列车 车票 旅客 可自 列车 停运 信息 公布 时起 车票 乘车 日期 日内 当日 办理 退票 手续 网站 手机 购买 铁路 电子客票 如未 打印 报销 凭证 使用 非现金 方式 支付 网站 手机 直接 办理 退票 或持 购票 时所 使用 乘车 有效 身份证件 原件 车站 窗口 办理 退票 旅客 使用 现金 方式 购买 打印 报销 凭证 网上 办理 退票 成功 之日起 当日 乘车 身份证件 铁路 车站 指定 窗口 办理 退款 手续 停运 列车 停运 信息 公布 购买 联程 车票 联程 车票 开车 一并 办理 退票 收取 退票费 台风 登陆 期间 南铁 密切 关注 台风 动向 影响 范围 加大 铁路 线路 设备 巡检 铁路 外部环境 安全 排查 确保 旅客 出行 安全 结合 风速 雨量 实际 情况 采取 限速 停运 迂回 折返 加开 恢复 开行 措施 动态 调整 列车 开行 方案 关注 建议 加强 防范 强降雨 次生 灾害 台风 影响 期间 我县 累计 雨量 发生 中小 河流 洪水 山洪 地质灾害 城乡 积涝 风险 部门 密切 关注 雨水 变化 做好 灾害 易发 监测 巡查 发生 险情 及时 转移 灾害 威胁 群众 做好 大风 防御 工作 电力 通讯 设施 户外 悬挂 广告牌 简易 工棚 危房 等易 大风 影响 提前 进行 安全检查 台风 影响 期间 减少 停止 高空 户外 涉水 作业 及时 加固 拆除 危旧房屋 临时 搭建 加强 交通 旅游 安全 管理 目前 正值 暑期 旅游 旺季 强降水 大风 雷电 天气 交通 旅游 安全 带来 风险 部门 加强 安全 管理 公众 及时 关注 当地 天气 气象 预警 信息 避开 台风 影响 时段 区域 合理安排 出行 活动 做好 人工 增雨 工作 保证 安全 前提 我局 抓住 有利 天气 条件 前期 降水 偏少 蓄水 不足 乡镇 适时 开展 人工 增雨 作业 补充 水资源 部门 密切 关注 水情 供水 形势 科学 做好 江河 湖库 各类 抗旱 工程 联合 调度 统筹 加强 水资源 优化 利用 工作 加强 农业 生产 管理 暴雨 大风 双抢 设施 农业 不利 影响 各乡镇 风雨 来临 抓紧 完成 早稻 收晒 晚稻 移栽 注意 避开 强降水 影响 作物 大棚 禽畜 圈舍 提前 检修 加固 一季 稻田 加强 排水 以防 积涝 综合 江西 天气 铅山 气象,"停运, 厦门, 福州, 北开, 毫米"
749,3,收好 这份 避险 自救 指南 北京市 气象台 发布 雨量 跟踪 时至 北京地区 全市 平均 降雨量 毫米 城区 平均 毫米 最大 降雨 出现 房山 流水 毫米 最大 小时 雨强 出现 顺义 石槽 降雨量 毫米 目前 降水 雨势 相对 平缓 预计 未来 小时 本市 降雨 由南向北 逐渐 加强 最大 小时 雨强 毫米 夏季 暴雨 多发 收到 暴雨 预警 做好 防护 紧急 时有 注意事项 雨天 出行 防范 城市 内涝 突发 洪水 快收 这份 暴雨 避险 自救 指南,"暴雨, 出现, 大暴雨, 防范, 北京"
750,36,发布 头条 文章 永年 发布 洪水 黄色 预警 紧急通知 永年 发布 洪水 黄色 预警 紧急通知,"洪水, 流域, 预警, 蓝色, 永定河"
751,-1,暴雨 洪灾 来袭 应对 中央气象台 继续 发布 暴雨 红色 预警 预计 河北 北京 天津 山西 河南 山东 大暴雨 水利部 中国气象局 联合 发布 红色 山洪 灾害 气象 预警 北京 启动 防汛 红色 响应 暂停 各类 演出 活动 暴雨 洪灾 来袭 应对 收好 这份 避险 自救 攻略 关键时刻 救命 应急 管理部,异常值
752,7,北京 不易 幼鸟 指南 演唱会 北京站 原定 北京 举行 北京 发布 防汛 红色 预警 主办方 演唱会 当天 上午 发出 取消 公告 引起争议 不少 粉丝 表示 遇到 极端 天气 取消 办法 粉丝 表示 主办方 提前 通知 选择 演唱会 当天 通知 部分 粉丝 已经 到达 北京 面临 取消 粉丝 表示 极端 天气 理解 能够 延期 取消 主办方 活动 当天 通知 取消 活动 行为 北京 白鹿,"台风, 保险, 北京, 部分, 强度"
753,-1,暴雨 洪灾 来袭 应对 中央气象台 继续 发布 暴雨 红色 预警 预计 河北 北京 天津 山西 河南 山东 大暴雨 水利部 中国气象局 联合 发布 红色 山洪 灾害 气象 预警 北京 启动 防汛 红色 响应 暂停 各类 演出 活动 暴雨 洪灾 来袭 应对 收好 这份 避险 自救 攻略 关键时刻 救命 应急 管理部,异常值
754,-1,暴雨 洪灾 来袭 应对 中央气象台 继续 发布 暴雨 红色 预警 预计 河北 北京 天津 山西 河南 山东 大暴雨 水利部 中国气象局 联合 发布 红色 山洪 灾害 气象 预警 北京 启动 防汛 红色 响应 暂停 各类 演出 活动 暴雨 洪灾 来袭 应对 收好 这份 避险 自救 攻略 关键时刻 救命 应急 管理部,异常值
755,6,廊坊 师范学院 超话 台风 杜苏芮 残余 环流 影响 河北 北京 天津 河南 降雨 具有 极端 致灾 风险 暴雨 尽量减少 出门 不到 山区 游玩 不吃 洪水 浸泡 食物 生水 开水 桶装水 水后 伤口处 消毒 互相 提醒,"食物, 风险, 不吃, 互相, 伤口处"
756,4,警示 曝光 北京 防洪 排涝 响应 有人 河道 周边 垂钓 北京市 水务局 升级 发布 防洪 排涝 应急 响应 上午 河湖 巡查 人员 发现 有人 劝阻 淋雨 河边 垂钓 已经 及时 劝离 提示 全市 市民 远离 河道 正在 行洪 北京 全市 加强 洪水 内涝 山洪 灾害 监测 工作 及时 滚动 发布 洪水 内涝 山洪 灾害 监测 预报 预警 信息 新闻广播 晨光 北京 新闻广播,"北京, 洪水, 发布, 防洪, 内涝"
757,36,上午 左右 赞皇县 公安局 阳泽 派出所 巡逻 北平 旺过 路面 发现 一辆车 被困 深水 路段 雨水 全体 民辅警 立即 车主 推到 路边,"洪水, 流域, 预警, 蓝色, 永定河"
758,22,台风 气象台 发布 预警 洪水 不是 玩笑 生命安全 无小事 昨日 晚间 凌晨 今早 各类 演出 陆续 宣布 关闭 天津 北京 地方 泄洪 群众 已经 撤离 这是 国家 生命安全 保证 不易 积极 配合 取消 演唱会 现在 预防 临时 取消 天灾 面前 能够 最大 限度 保证 生命安全 这是 昨晚 演唱会 上座率 昨晚 通知 取消 北京 上座率 极高 存在 卖不出去 取消 原因 昨晚 北京 正常 举行 通知 积极 配合 国家 政策 随时 上级 通知 进行 更改 不要 了解 真相 无端 抹黑 相信 一位 买到 理解 情况 支持 一位 买票 主办方 维权,"安全, 工作, 单位, 预警, 做好"
759,25,今天 白天 夜间 维持 暴雨 红色 预警 信号 北京 持续 防汛 红色 一级 预警 响应 气象台 最新 预报 台风 减弱 热带 低压 副热带 高压 外围 暖湿气流 共同 作用 预计 日本 市有 暴雨 大暴雨 局地 大暴雨 伴有 东风 阵风 全市 大部分 地区 降雨量 毫米 西部 南部 部分 地区 毫米 最大 雨强 毫米 小时 降雨 影响 白天 最高 气温 左右 今天 白天 夜间 维持 暴雨 红色 预警 信号 北京 持续 防汛 红色 一级 预警 响应 北京市 防汛 指挥部 提醒 广大 市民 非必要 外出 企事业 单位 保障 城市 运行 民生 服务 非必要 要求 员工 上班 时至 全市 平均 降雨量 毫米 山区 山区 山洪 滑坡 崩塌 泥石流 次生 灾害 风险 广大 市民 远离 河道 提防 流域 洪水 滑坡 泥石流 再次 提示 公众 不要 前往 山区 河道 地质灾害 隐患 区域 请勿 涉水 行车 雷雨 大风 不要 高大 建筑物 广告牌 临时 搭建 大树下 停留 北京 应急,"毫米, 预警, 红色, 防汛, 山区"
760,36,目击者 救出 河北 衡水 男子 驾驶 越野车 渡河 车子 进入 河道 水流 冲走 目击者 李先生 当时 看到 这辆 车想 渡河 对岸 河水 水流 急车 河道 深处 幸好 河底 石头 营救 赢得 时间 随后 有人 进入 河道 车主 救援 上岸 衡水 点时 新闻,"洪水, 流域, 预警, 蓝色, 永定河"
761,28,北京 通州 个村 做好 人员 转移 准备 通州区 防汛 消息 目前 全区 在建 工程 全部 停工 涉水 景区 公园 环球 影城 度假区 关闭 全区 座下 凹桥 运通 隧道 积水 道路 余名 抢险 人员 余台 抢险 设备 前置 备勤 随时 开展 应急 抢险 交管部门 加强 警力 部署 和易 积水 路段 巡查 积水 严重 果断 断路 中心 重要 交通 路口 最高级别 响应 予以 保障 确保 交通 运行 平稳 本次 强降雨 通州区 防汛 焦点 北运河 采取 一系列 措施 应对 流域 可能 出现 超标 洪水 确保重点 部位 安全 一是 针对 北运河 堤防 豁口 宋庄 富豪 公里 围堤 提前 行动 连夜 奋战 今日 完成 豁口 封堵 围堤 抢筑 二是 全区 针对 北运河 潮白河 堤内 北运河 堤内 涉及 西集 潮白河 堤内 涉及 宋庄 潞城 西集 下发 转移 通知 乡镇 再次 核实 人员 信息 确保 不漏 一户 不漏 一人 做好 人员 转移 准备 时至 全区 平均 降雨 毫米 最大 雨强 毫米 台湖 镇政府 全区 出现 明显 积水 突发事件 北京 交通广播,"毫米, 应急, 做好, 防汛, 组织"
762,36,老人 赶羊 洪水 冲走 牧羊犬 死死 咬住 老人 裤脚 拍摄者 老人 这条 真是 一命 来源 河北 日报 武汉 交通广播,"洪水, 流域, 预警, 蓝色, 永定河"
763,36,大事不好 下水道 往上 院子 积水 脚踝 不会 家淹 这雨 几天 公公 保定 必涝 严重,"洪水, 流域, 预警, 蓝色, 永定河"
