Document_ID,Topic,Text,Top_Keywords
549,32,分享 凤凰 新闻 北京市 水文 总站 发布 洪水 橙色 预警 北京市 水文 总站 发布 洪水 橙色 预警 凤凰网 财经 凤凰网 来自 北京市 水文 总站 发布 洪水 橙色 预警 凤凰网 财经 凤凰网,"洪水, 预警, 橙色, 发布, 流域"
550,32,北京 发布 洪水 橙色 预警 防汛 提示 水文 总站 发布 洪水 橙色 预警 预计 日至 我市 大暴雨 大暴雨 北运河 流域 可能 出现 橙色 预警 级别 洪水 城区 河道 永定河 流域 大清河 流域 可能 出现 黄色 预警 级别 洪水,"洪水, 预警, 橙色, 发布, 流域"
551,34,半夜 被市 防汛 提示 短信 吵醒 骂街,"城区, 地区, 防汛, 半夜, 地下"
552,27,没下 平谷 凌晨 三点 现在,"没下, 现在, 下雨, 别下, 台风"
553,-1,洪水,异常值
554,27,坐等 大雨 预警 吓跑,"没下, 现在, 下雨, 别下, 台风"
555,33,昨天 发短信 每次 大张旗鼓 报道 不准,"今天, 天气, 台风, 影响, 暴雨"
556,17,密云,"关注, 延庆, 现在, 多久, 顺义"
557,30,北京市 发布 应对 措施 北京市 发布 暴雨 红色 预警 信号 防汛 指挥部 启动 全市 防汛 红色 一级 预警 响应 防汛 指挥部 提醒 广大 市民 非必要 外出 单位 落实 响应 措施 做好 相关 应对 准备 气象预报 显示 预计 夜间 夜间 本市 出现 大暴雨 西部 南部 大暴雨 主要 降雨 过程 出现 时至 全市 大暴雨 房山 门头沟 昌平 海淀 石景山 丰台 延庆 大兴 通州 西城 东城 朝阳 部分 地区 有特 大暴雨 防汛 红色 预警 响应 发布 预警 解除 为止 企事业 单位 保障 城市 运行 民生 服务 非必要 要求 员工 上班 广大 市民 非必要 外出 遇有 积水 路段 请勿 涉水 行车 不要 低洼 路段 区域 停放 车辆 地下室 居住 人员 密切 关注 降雨 内涝 风险 及时 避险 遇有 紧急情况 及时 拨打 紧急 救助 电话 本市 关闭 山洪 沟道 广大 市民 远离 河道 提防 流域 洪水 滑坡 泥石流 停止 组织 室内 室外 文化 体育 娱乐活动 做好 相关 人员 安全 疏散 工作 地下 经营性 场所 停业 学校 停止 全部 线下 教学活动 野外 教学活动 培训 机构 停止 全部 线下 培训 活动 妥善安置 安全 转移 相应 滞留 人员 在建 工地 停工 及时 转移 妥善安置 相关 工地 人员 停止 涉山 涉水 户外 旅游 关闭 所有 景区 公园 林场 民宿 民俗 停业 游客 疏导 劝返 做好 威胁 游客 疏散 避险 山区 险村 险户 滞留 游客 城区 危旧房屋 低洼 院落 威胁 人员 服从安排 尽早 转移 重点 危险 区域 主要 抢险 救援 道路 实施 临时 交通管制 措施 必要 采取 地铁 公交 停运 措施 北京市 防汛 指挥部 发布 应对 全市 防汛 红色 一级 预警 措施 企事业 单位 保障 城市 运行 民生 服务 非必要 要求 员工 上班 广大 市民 非必要 外出 遇有 积水 路段 请勿 涉水 行车 不要 低洼 路段 区域 停放 车辆 地下室 居住 人员 密切 关注 降雨 内涝 风险 及时 避险 遇有 紧急情况 及时 拨打 停止 组织 室内 室外 文化 体育 娱乐活动 做好 相关 人员 安全 疏散 工作 地下 经营性 场所 停业 学校 停止 全部 线下 教学活动 野外 教学活动 培训 机构 停止 全部 线下 培训 活动 妥善安置 安全 转移 相应 滞留 人员 在建 工地 停工 及时 转移 妥善安置 相关 工地 人员 停止 涉山 涉水 户外 旅游 关闭 所有 景区 公园 林场 民宿 民俗 停业 游客 疏导 劝返 做好 威胁 游客 疏散 避险 及时 转移 安置 全部 威胁 群众 重点 关注 山区 险村 险户 滞留 游客 城区 危旧房屋 低洼 院落 威胁 人员 重点 危险 区域 主要 抢险 救援 道路 实施 临时 交通管制 措施 必要 采取 地铁 公交 停运 措施 关闭 山洪 沟道 广大 市民 远离 河道 提防 流域 洪水 滑坡 泥石流 北京,"人员, 防汛, 停止, 及时, 预警"
558,31,防汛 红色 预警 响应 启动 北京市 发布 应对 措施 北京市 发布 暴雨 红色 预警 信号 防汛 指挥部 启动 全市 防汛 红色 一级 预警 响应 防汛 指挥部 提醒 广大 市民 非必要 外出 单位 落实 响应 措施 做好 相关 应对 准备 气象预报 显示 预计 夜间 夜间 本市 出现 大暴雨 西部 南部 大暴雨 主要 降雨 过程 出现 时至 全市 大暴雨 房山 门头沟 昌平 海淀 石景山 丰台 延庆 大兴 通州 西城 东城 朝阳 部分 地区 有特 大暴雨 防汛 红色 预警 响应 发布 预警 解除 为止 企事业 单位 保障 城市 运行 民生 服务 非必要 要求 员工 上班 广大 市民 非必要 外出 遇有 积水 路段 请勿 涉水 行车 不要 低洼 路段 区域 停放 车辆 地下室 居住 人员 密切 关注 降雨 内涝 风险 及时 避险 遇有 紧急情况 及时 拨打 紧急 救助 电话 本市 关闭 山洪 沟道 广大 市民 远离 河道 提防 流域 洪水 滑坡 泥石流 停止 组织 室内 室外 文化 体育 娱乐活动 做好 相关 人员 安全 疏散 工作 地下 经营性 场所 停业 学校 停止 全部 线下 教学活动 野外 教学活动 培训 机构 停止 全部 线下 培训 活动 妥善安置 安全 转移 相应 滞留 人员 在建 工地 停工 及时 转移 妥善安置 相关 工地 人员 停止 涉山 涉水 户外 旅游 关闭 所有 景区 公园 林场 民宿 民俗 停业 游客 疏导 劝返 做好 威胁 游客 疏散 避险 山区 险村 险户 滞留 游客 城区 危旧房屋 低洼 院落 威胁 人员 服从安排 尽早 转移 重点 危险 区域 主要 抢险 救援 道路 实施 临时 交通管制 措施 必要 采取 地铁 公交 停运 措施 北京市 防汛 指挥部 发布 应对 全市 防汛 红色 一级 预警 措施 企事业 单位 保障 城市 运行 民生 服务 非必要 要求 员工 上班 广大 市民 非必要 外出 遇有 积水 路段 请勿 涉水 行车 不要 低洼 路段 区域 停放 车辆 地下室 居住 人员 密切 关注 降雨 内涝 风险 及时 避险 遇有 紧急情况 及时 拨打 停止 组织 室内 室外 文化 体育 娱乐活动 做好 相关 人员 安全 疏散 工作 地下 经营性 场所 停业 学校 停止 全部 线下 教学活动 野外 教学活动 培训 机构 停止 全部 线下 培训 活动 妥善安置 安全 转移 相应 滞留 人员 在建 工地 停工 及时 转移 妥善安置 相关 工地 人员 停止 涉山 涉水 户外 旅游 关闭 所有 景区 公园 林场 民宿 民俗 停业 游客 疏导 劝返 做好 威胁 游客 疏散 避险 及时 转移 安置 全部 威胁 群众 重点 关注 山区 险村 险户 滞留 游客 城区 危旧房屋 低洼 院落 威胁 人员 重点 危险 区域 主要 抢险 救援 道路 实施 临时 交通管制 措施 必要 采取 地铁 公交 停运 措施 关闭 山洪 沟道 广大 市民 远离 河道 提防 流域 洪水 滑坡 泥石流,"人员, 停止, 防汛, 及时, 措施"
559,19,暴雨 天气 保平安 这份 安全 指南 收好 出行 如遇 大雨 天气 才能 确保 平安 不同 出行 方式 注意 洪水 到来 自救 这份 暴雨 天气 安全 指南 收好 媒体 平安 新闻 转给 更多人,"天气, 安全, 出行, 收好, 这份"
560,26,安全 无小事 平安 出行,"注意安全, 安全, 话筒, 平安, 晚安"
561,26,安全 无小事,"注意安全, 安全, 话筒, 平安, 晚安"
562,17,关注,"关注, 延庆, 现在, 多久, 顺义"
563,17,关注,"关注, 延庆, 现在, 多久, 顺义"
564,23,发布 防汛 预警 措施 北京日报 气象预报 显示 预计 夜间 夜间 北京市 出现 大暴雨 西部 南部 大暴雨 主要 降雨 过程 出现 时至 全市 大暴雨 房山 门头沟 昌平 海淀 石景山 丰台 延庆 大兴 通州 西城 东城 朝阳 部分 地区 有特 大暴雨 北京市 防汛 指挥部 发布 应对 全市 防汛 红色 一级 预警 措施 企事业 单位 保障 城市 运行 民生 服务 非必要 要求 员工 上班 广大 市民 非必要 外出 遇有 积水 路段 请勿 涉水 行车 不要 低洼 路段 区域 停放 车辆 地下室 居住 人员 密切 关注 降雨 内涝 风险 及时 避险 遇有 紧急情况 及时 拨打 停止 组织 室内 室外 文化 体育 娱乐活动 做好 相关 人员 安全 疏散 工作 地下 经营性 场所 停业 学校 停止 全部 线下 教学活动 野外 教学活动 培训 机构 停止 全部 线下 培训 活动 妥善安置 安全 转移 相应 滞留 人员 在建 工地 停工 及时 转移 妥善安置 相关 工地 人员 停止 涉山 涉水 户外 旅游 关闭 所有 景区 公园 林场 民宿 民俗 停业 游客 疏导 劝返 做好 威胁 游客 疏散 避险 及时 转移 安置 全部 威胁 群众 重点 关注 山区 险村 险户 滞留 游客 城区 危旧房屋 低洼 院落 威胁 人员 重点 危险 区域 主要 抢险 救援 道路 实施 临时 交通管制 措施 必要 采取 地铁 公交 停运 措施 关闭 山洪 沟道 广大 市民 远离 河道 提防 流域 洪水 滑坡 泥石流,"人员, 及时, 停止, 大暴雨, 措施"
565,-1,河南 河北 见到 不少 村镇 河滩 以为 几十年 洪水 高枕无忧 最后 只能 愚蠢 交学费,异常值
566,32,北京 大兴 消防 超话 福建 泉州 台风 转移 积水 围困 部分 群众 消防员 赶赴 救援 背起 孩子 没过 腰间 水中 行走 污水 浑浊 朋友 打滑 站稳 上半身 不慎 栽进 污水 之中 紧紧 护着 肩上 孩子 最后 孩子 转移 安全 地带 网友 中国 消防,"洪水, 预警, 橙色, 发布, 流域"
567,28,防办 启动 防洪 三级 应急 响应 防办 发布 启动 防洪 三级 应急 响应 通知 据市 气象部门 预报 我市 日至 持续性 强降雨 过程 主要 降雨 时段 今天 凌晨 白天 累计 降雨量 毫米 部分 地区 毫米 局地 可达 毫米 最大 小时 降雨量 毫米 海河 流域 日至 累计 降雨量 毫米 部分 地区 毫米 局地 可达 毫米 最大 小时 降雨量 毫米 大清河 毫米 子牙河 毫米 海河 干流 毫米 水利部 海委 水文 预报 三河 永定河 大清河 子牙河 洪水 下泄 国家 防总 针对 北京 天津 河北 省市 防汛 应急 响应 升级 至级 天津市 防汛 抗旱 应急 预案 规定 防办 综合 会商 研判 决定 分将市 防洪 应急 响应 升级 为市 防洪 应急 响应 气象局 水务局 规划 资源 局市 公安局 城市 管理 委市 消防 救援 总队 防办 要求 组织 专业 骨干 到市 应急 救援 指挥中心 上岗 参加 联合 值守 工作 气象 海洋 水情 组要 密切 关注 天气 变化 及时 发布 气象 风暴潮 海浪 洪水 信息 调度 组要 做好 本市 主要 行洪 河道 调度 运行 工作 适时 提出 农村 排沥限禁排 调度 建议 抢险 组要 需要 组织 市级 防汛 应急 救援 队伍 执行 抢险救灾 任务 转移 安置 组要 准备 安置 群众 所需 救灾物资 设备 物资 组要 做好 调运 防汛 物资 准备 通讯 组要 组织 指导 基础 电信 运营 企业 铁塔 公司 开展 通信 保障 工作 保卫组 组织 做好 抢险救灾 物资 运输 路线 道路交通 秩序 保障 抢险救灾 现场 安全 警戒 人员 车辆 疏导 工作 交通运输 组要 筹划 集结 防汛 抢险救灾 行动 所需 运输 车辆 生活 保障 组要 指导 人民政府 做好 防汛 应急 队伍 转移 安置 群众 生活 保障 准备 信息 宣传组 适时 媒体 通报 雨水 工作 情况 市教委 组织 各区 区域 降雨 情况 中小学校 幼儿园 实施 弹性 教学 住房 城乡建设 委要 组织 做好 在建 工程 适时 停工 指导 各区 做好 危陋 房屋 群众 避险 转移 安置工作 城市 管理 委要 加强 户外 广告牌 搭建 防风 加固 交通运输 委要 适时 封闭 山区 路段 开展 损毁 路段 应急 抢修 商务局 组织 做好 生活必需品 市场供应 工作 电力公司 组织 做好 防汛 抢险救灾 电力 保障 工作 天津警备区 武警 天津 总队 消防 救援 总队 组织 做好 参加 防汛 抢险救灾 准备 工作组 市防指 成员 单位 各区 预案 做好 防汛 抢险救灾 准备 保障 工作 防办 启动 防洪 三级 应急 响应,"毫米, 应急, 做好, 防汛, 组织"
568,5,洪涝灾害 大雨 暴雨 引起 水道 急流 山洪暴发 河水 泛滥 淹没 农田 毁坏 环境 设施 现象 我国 洪水 大多 发生 三个 洪涝 水灾 主要 集中 中东部 地区 发生 我国 七大 江河 支流 中下游 地区 暴雨 洪水 引发 泥石流 山体 滑坡 灾害 容易 传染病 制造 生存 机会 洪涝灾害 提高 防病 意识 特别注意 环境 个人 饮食卫生 出现 腹泻 腹痛 恶心 呕吐 发热 症状 尽快 医疗机构 就医 新闻,"洪水, 暴雨, 台风, 影响, 杜苏芮"
569,29,北运河 流域 可能 出现 橙色 预警 级别 洪水 北京市 水文 总站 发布 洪水 橙色 预警 预计 日至 北京市 大暴雨 大暴雨 北运河 流域 可能 出现 橙色 预警 级别 洪水 城区 河道 永定河 流域 大清河 流域 可能 出现 黄色 预警 级别 洪水 全市 平均 降雨 水务 气象部门 再发 风险 提示 北京市 水务局 联合 北京市 气象局 再次 发布 城市 内涝 山洪 灾害 风险 提示 最新 气象预报 北京市 夜间 大暴雨 大暴雨 全市 平均 西部 南部 城区 可达 个别 大于 预计 西城 东城 昌平 朝阳 丰台 海淀 石景山 通州 大兴区 存在 严重 积水 风险 注意 防范 山洪 灾害 风险 提示 结合 前期 降雨 情况 预计 时至 北京市 房山区 门头沟区 延庆 昌平区 怀柔区 密云 平谷区 海淀区 石景山区 丰台区 可能 发生 山洪 灾害 房山区 门头沟区 延庆 南部 昌平区 石景山区 海淀区 丰台区 怀柔区 西南部 发生 可能性 很大 央视 新闻 客户端,"洪水, 应急, 防御, 工作, 做好"
570,5,洪涝灾害 大雨 暴雨 引起 水道 急流 山洪暴发 河水 泛滥 淹没 农田 毁坏 环境 设施 现象 我国 洪水 大多 发生 三个 洪涝 水灾 主要 集中 中东部 地区 发生 我国 七大 江河 支流 中下游 地区 暴雨 洪水 引发 泥石流 山体 滑坡 灾害 容易 传染病 制造 生存 机会 洪涝灾害 提高 防病 意识 特别注意 环境 个人 饮食卫生 出现 腹泻 腹痛 恶心 呕吐 发热 症状 尽快 医疗机构 就医 新闻,"洪水, 暴雨, 台风, 影响, 杜苏芮"
571,19,安全 宝典 超话 暴雨 天气 保平安 这份 安全 指南 收好 出行 如遇 大雨 天气 才能 确保 平安 不同 出行 方式 注意 洪水 到来 自救 这份 暴雨 天气 安全 指南 收好 媒体 平安 新闻 转给 更多人,"天气, 安全, 出行, 收好, 这份"
572,29,北运河 流域 可能 出现 橙色 预警 级别 洪水 北京市 水文 总站 发布 洪水 橙色 预警 预计 日至 北京市 大暴雨 大暴雨 北运河 流域 可能 出现 橙色 预警 级别 洪水 城区 河道 永定河 流域 大清河 流域 可能 出现 黄色 预警 级别 洪水 全市 平均 降雨 水务 气象部门 再发 风险 提示 北京市 水务局 联合 北京市 气象局 再次 发布 城市 内涝 山洪 灾害 风险 提示 最新 气象预报 北京市 夜间 大暴雨 大暴雨 全市 平均 西部 南部 城区 可达 个别 大于 预计 西城 东城 昌平 朝阳 丰台 海淀 石景山 通州 大兴区 存在 严重 积水 风险 注意 防范 山洪 灾害 风险 提示 结合 前期 降雨 情况 预计 时至 北京市 房山区 门头沟区 延庆 昌平区 怀柔区 密云 平谷区 海淀区 石景山区 丰台区 可能 发生 山洪 灾害 房山区 门头沟区 延庆 南部 昌平区 石景山区 海淀区 丰台区 怀柔区 西南部 发生 可能性 很大 央视 新闻 客户端,"洪水, 应急, 防御, 工作, 做好"
573,29,北运河 流域 可能 出现 橙色 预警 级别 洪水 北京市 水文 总站 发布 洪水 橙色 预警 预计 日至 北京市 大暴雨 大暴雨 北运河 流域 可能 出现 橙色 预警 级别 洪水 城区 河道 永定河 流域 大清河 流域 可能 出现 黄色 预警 级别 洪水 全市 平均 降雨 水务 气象部门 再发 风险 提示 北京市 水务局 联合 北京市 气象局 再次 发布 城市 内涝 山洪 灾害 风险 提示 最新 气象预报 北京市 夜间 大暴雨 大暴雨 全市 平均 西部 南部 城区 可达 个别 大于 预计 西城 东城 昌平 朝阳 丰台 海淀 石景山 通州 大兴区 存在 严重 积水 风险 注意 防范 山洪 灾害 风险 提示 结合 前期 降雨 情况 预计 时至 北京市 房山区 门头沟区 延庆 昌平区 怀柔区 密云 平谷区 海淀区 石景山区 丰台区 可能 发生 山洪 灾害 房山区 门头沟区 延庆 南部 昌平区 石景山区 海淀区 丰台区 怀柔区 西南部 发生 可能性 很大 央视 新闻 客户端,"洪水, 应急, 防御, 工作, 做好"
574,29,北运河 流域 可能 出现 橙色 预警 级别 洪水 北京市 水文 总站 发布 洪水 橙色 预警 预计 日至 北京市 大暴雨 大暴雨 北运河 流域 可能 出现 橙色 预警 级别 洪水 城区 河道 永定河 流域 大清河 流域 可能 出现 黄色 预警 级别 洪水 全市 平均 降雨 水务 气象部门 再发 风险 提示 北京市 水务局 联合 北京市 气象局 再次 发布 城市 内涝 山洪 灾害 风险 提示 最新 气象预报 北京市 夜间 大暴雨 大暴雨 全市 平均 西部 南部 城区 可达 个别 大于 预计 西城 东城 昌平 朝阳 丰台 海淀 石景山 通州 大兴区 存在 严重 积水 风险 注意 防范 山洪 灾害 风险 提示 结合 前期 降雨 情况 预计 时至 北京市 房山区 门头沟区 延庆 昌平区 怀柔区 密云 平谷区 海淀区 石景山区 丰台区 可能 发生 山洪 灾害 房山区 门头沟区 延庆 南部 昌平区 石景山区 海淀区 丰台区 怀柔区 西南部 发生 可能性 很大 央视 新闻 客户端,"洪水, 应急, 防御, 工作, 做好"
575,29,北运河 流域 可能 出现 橙色 预警 级别 洪水 北京市 水文 总站 发布 洪水 橙色 预警 预计 日至 北京市 大暴雨 大暴雨 北运河 流域 可能 出现 橙色 预警 级别 洪水 城区 河道 永定河 流域 大清河 流域 可能 出现 黄色 预警 级别 洪水 全市 平均 降雨 水务 气象部门 再发 风险 提示 北京市 水务局 联合 北京市 气象局 再次 发布 城市 内涝 山洪 灾害 风险 提示 最新 气象预报 北京市 夜间 大暴雨 大暴雨 全市 平均 西部 南部 城区 可达 个别 大于 预计 西城 东城 昌平 朝阳 丰台 海淀 石景山 通州 大兴区 存在 严重 积水 风险 注意 防范 山洪 灾害 风险 提示 结合 前期 降雨 情况 预计 时至 北京市 房山区 门头沟区 延庆 昌平区 怀柔区 密云 平谷区 海淀区 石景山区 丰台区 可能 发生 山洪 灾害 房山区 门头沟区 延庆 南部 昌平区 石景山区 海淀区 丰台区 怀柔区 西南部 发生 可能性 很大 央视 新闻 客户端,"洪水, 应急, 防御, 工作, 做好"
576,26,注意安全,"注意安全, 安全, 话筒, 平安, 晚安"
577,14,思考 思考 思考,"预报, 思考, 单身, 话筒, 暴雨"
578,26,安全 第一 大家伙,"注意安全, 安全, 话筒, 平安, 晚安"
579,27,演唱会 举行,"没下, 现在, 下雨, 别下, 台风"
580,26,注意安全,"注意安全, 安全, 话筒, 平安, 晚安"
581,12,防汛 一级 预警 响应 北京 明天 处于 降水 核心 时段 需防 极端 强降雨 台风 残余 环流 副热带 高压 外围 暖湿气流 共同 影响 明天 日至 北京 雨势 强劲 今天 暴雨 大暴雨 明天 西部 地区 暴雨 本次 降雨 过程 持续时间 累计 雨量 具有 一定 极端 北京市 启动 全市 防汛 红色 一级 预警 响应 暴雨 山洪 六大 预警 信号 齐发 需注意 防范 明天 北京 处于 本次 降水 过程 核心 时段 北京市 气象台 今晨 发布 天气预报 预计 今天 早晨 白天 暴雨 大暴雨 东风 二级 转三至 四级 阵风 六至 七级 最高 气温 夜间 暴雨 西部 南部 大暴雨 东风 三至 四级 阵风 六级 左右 最低气温 明天 白天 北京 阴有 大雨 西部 地区 暴雨 阵风 六至 七级 最高 气温 明天 夜间 阴有 大雨 最低气温 北京 小雨 气象部门 提醒 北京 此次 降雨 过程 持续时间 累计 雨量 具有 一定 极端 目前 最高 等级 暴雨 红色 预警 信号 生效 雷电 山洪 渍涝 中小 河流 洪水 地质灾害 预警 齐发 北京市 防汛 提示 北京 启动 全市 防汛 红色 一级 预警 响应 全市 单位 保障 城市 基本 运行 原则上 居家 办公 停工 停业 减少 外出 确保安全,"北京, 暴雨, 降雨, 大暴雨, 影响"
582,32,北京 发布 洪水 橙色 预警 发布 消息 防汛 提示 水文 总站 发布 洪水 橙色 预警 预计 日至 我市 大暴雨 大暴雨 北运河 流域 可能 出现 橙色 预警 级别 洪水 城区 河道 永定河 流域 大清 河流,"洪水, 预警, 橙色, 发布, 流域"
583,12,防汛 一级 预警 响应 北京 明天 处于 降水 核心 时段 需防 极端 强降雨 台风 残余 环流 副热带 高压 外围 暖湿气流 共同 影响 明天 日至 北京 雨势 强劲 今天 暴雨 大暴雨 明天 西部 地区 暴雨 本次 降雨 过程 持续时间 累计 雨量 具有 一定 极端 北京市 启动 全市 防汛 红色 一级 预警 响应 暴雨 山洪 六大 预警 信号 齐发 需注意 防范 明天 北京 处于 本次 降水 过程 核心 时段 北京市 气象台 今晨 发布 天气预报 预计 今天 早晨 白天 暴雨 大暴雨 东风 二级 转三至 四级 阵风 六至 七级 最高 气温 夜间 暴雨 西部 南部 大暴雨 东风 三至 四级 阵风 六级 左右 最低气温 明天 白天 北京 阴有 大雨 西部 地区 暴雨 阵风 六至 七级 最高 气温 明天 夜间 阴有 大雨 最低气温 北京 小雨 气象部门 提醒 北京 此次 降雨 过程 持续时间 累计 雨量 具有 一定 极端 目前 最高 等级 暴雨 红色 预警 信号 生效 雷电 山洪 渍涝 中小 河流 洪水 地质灾害 预警 齐发 北京市 防汛 提示 北京 启动 全市 防汛 红色 一级 预警 响应 全市 单位 保障 城市 基本 运行 原则上 居家 办公 停工 停业 减少 外出 确保安全,"北京, 暴雨, 降雨, 大暴雨, 影响"
584,19,暴雨 天气 保平安 这份 安全 指南 收好 出行 如遇 大雨 天气 才能 确保 平安 不同 出行 方式 注意 洪水 到来 自救 这份 暴雨 天气 安全 指南 收好 媒体 平安 新闻 转给 更多人,"天气, 安全, 出行, 收好, 这份"
585,32,北京 发布 洪水 橙色 预警 京报 北京 预警 官方 消息 防汛 提示 水文 总站 发布 洪水 橙色 预警 预计 日至 我市 大暴雨,"洪水, 预警, 橙色, 发布, 流域"
586,7,万个 沙袋 工人 连夜 封死 运河 豁口 下午 北京市 通州区 世纪 星河 名苑 小区 门口 突然 一群 防汛 工作者 准备 万个 沙袋 上百 机械 多名 工人 确保 今晚 运河 防洪 堤坝 完全 垒成,"台风, 保险, 北京, 部分, 强度"
