Document_ID,Topic,Text,Top_Keywords
0,-1,杜苏芮 福建 福清 广东 惠来 一带 沿海 登陆 国家 防总 办公室 应急 管理部 组织 防汛防台 专题 会商 调度 中国气象局 水利部 自然资源 会商 研判 今年 台风 杜苏芮 发展 态势 连线 福建 广东 浙江 四川 省份 防指 办公室 调度 部署 重点 地区 防汛防台 工作 会商 研判 台风 杜苏芮 夜间 早晨 移入 南海 东北部 逐渐 闽粤 沿海 靠近 早晨 上午 福建 福清 广东 惠来 一带 沿海 登陆 强台风 台风 杜苏芮 具有 沿海 风浪 降雨 强度 影响 范围 特点 深入 内陆 北上 可能 影响 福建 广东 浙江 江西 安徽 山东 河南 河北 天津 北京 省市 防汛防台 形势严峻 任务艰巨 会商 强调 当前 处于 防汛防台 关键时期 紧要 阶段 各地 部门 最高 标准 严要求 做足 各项 防御 措施 突出 抓好 船只 回港 避风 人员 上岸 避险 危险 地区 群众 转移 安置 工作 全面落实 中小 河流 洪水 中小 水库 度汛 山洪 地质灾害 城市 内涝 薄弱环节 防御 措施 提前 关闭 沿海 旅游景点 加强 沿海 石油化工 核电 铁路 机场 矿山企业 重要 设施 电力通信 供水 生命线 工程 安全检查 集中力量 高效 抢险 救援 救灾 努力做到 不死 人少 伤人 损失,异常值
1,-1,国家 防总 提升 防汛防台 应急 响应 三级 今年 台风 杜苏芮 逐渐 闽粤 沿海 靠近 应急 管理部 获悉 国家 防总 当日 防汛防台 应急 响应 提升 三级 派出 工作组 浙江 福建 广东 江西 协助 指导 防汛防台 工作 国家 防总 办公室 应急 管理部 组织 防汛防台 专题 会商 调度 中国气象局 水利部 自然资源 会商 研判 台风 杜苏芮 发展 态势 连线 福建 广东 浙江 四川 省份 防指 办公室 调度 部署 重点 地区 防汛防台 工作 会商 研判 台风 杜苏芮 夜间 早晨 移入 南海 东北部 早晨 上午 福建 福清 广东 惠来 一带 沿海 登陆 台风 杜苏芮 具有 沿海 风浪 降雨 强度 影响 范围 特点 深入 内陆 北上 可能 影响 福建 广东 浙江 江西 安徽 山东 河南 河北 天津 北京 省市 防汛防台 形势严峻 任务艰巨 会商 强调 当前 处于 防汛防台 关键时期 紧要 阶段 各地 部门 各项 防御 措施 突出 抓好 船只 回港 避风 人员 上岸 避险 危险 地区 群众 转移 安置 工作 全面落实 中小 河流 洪水 中小 水库 度汛 山洪 地质灾害 城市 内涝 薄弱环节 防御 措施 提前 关闭 沿海 旅游景点 加强 沿海 石油化工 核电 铁路 机场 矿山企业 重要 设施 电力通信 供水 生命线 工程 安全检查 集中力量 高效 抢险 救援 救灾 应急 管理部 工程 抢险 航空 救援 排涝 应急 力量 进行 省区 优化 调整 协调 落实 余人 直升机 做好 随时 增援 准备,异常值
2,-1,国家 防总 办公室 应急 管理部 组织 防汛防台 专题 会商 调度 中国气象局 水利部 自然资源 会商 研判 今年 台风 杜苏芮 发展 态势 连线 福建 广东 浙江 四川 省份 防指 办公室 调度 部署 重点 地区 防汛防台 工作 会商 研判 台风 杜苏芮 夜间 早晨 移入 南海 东北部 逐渐 闽粤 沿海 靠近 早晨 上午 福建 福清 广东 惠来 一带 沿海 登陆 强台风 台风 杜苏芮 具有 沿海 风浪 降雨 强度 影响 范围 特点 深入 内陆 北上 可能 影响 福建 广东 浙江 江西 安徽 山东 河南 河北 天津 北京 省市 防汛防台 形势严峻 任务艰巨 会商 强调 当前 处于 防汛防台 关键时期 紧要 阶段 各地 部门 最高 标准 严要求 做足 各项 防御 措施 突出 抓好 船只 回港 避风 人员 上岸 避险 危险 地区 群众 转移 安置 工作 全面落实 中小 河流 洪水 中小 水库 度汛 山洪 地质灾害 城市 内涝 薄弱环节 防御 措施 提前 关闭 沿海 旅游景点 加强 沿海 石油化工 核电 铁路 机场 矿山企业 重要 设施 电力通信 供水 生命线 工程 安全检查 集中力量 高效 抢险 救援 救灾 努力做到 不死 人少 伤人 损失 国家 防总 防汛防台 应急 响应 提升 三级 派出 工作组 浙江 福建 广东 江西 协助 指导 防汛防台 工作 应急 管理部 工程 抢险 航空 救援 排涝 应急 力量 进行 省区 优化 调整 协调 落实 余人 直升机 做好 随时 增援 准备 央视 新闻 客户端,异常值
3,13,遥遥 想起 两年 大约 去往 北京 高铁 途径 河南 害怕 暴雨 余波 火车 冲垮 彻夜难眠 回程 洪水 毁掉 庄稼 农田 车厢 安静 令人窒息,"山洪, 暴雨, 不要, 了解, 洪水"
4,27,焉知 不是 命运,"没下, 现在, 下雨, 别下, 台风"
5,29,河北省 水利厅 水旱灾害 防御 应急 响应 工作 规程 河北省 水利厅 决定 今日 针对 全省 水利 系统启动 洪水 防御 应急 响应 据预测 今年 台风 杜苏芮 福建 广东 附近 登陆 随后 西北 方向 移动 受其 登陆 影响 日至 河北 大部 大到暴雨 局地 大暴雨 三河 永定河 大清河 子牙河 漳卫河 河系 可能 发生 洪水 本次 台风 具有 强度 水汽 量足 影响 范围广 持续时间 特点 水利厅 要求 各地 单位 高度重视 进一步 压实 防御 责任 加强 值班 值守 密切 关注 雨水 强化 监测 预报 预警 做好 水库 闸涵 工程 科学 调度 落实 各项 防御 措施 加大 防洪工程 巡查 力度 提早 转移 威胁 群众 险情 及早 处置 确保安全 度汛,"洪水, 应急, 防御, 工作, 做好"
6,29,台风 杜苏芮 带来 大到暴雨 河北 启动 洪水 防御 应急 响应 河北省 水利厅 水旱灾害 防御 应急 响应 工作 规程 水利厅 决定 今天 针对 全省 水利 系统启动 洪水 防御 应急 响应 据预测 今年 台风 杜苏芮 福建 广东 附近 登陆 随后 西北 方向 移动 受其 登陆 影响 日至 河北 大部 大到暴雨 局地 大暴雨 三河 永定河 大清河 子牙河 漳卫河 河系 可能 发生 洪水 本次 台风 具有 强度 水汽 量足 影响 范围广 持续时间 特点 水利厅 要求 各地 单位 高度重视 进一步 压实 防御 责任 加强 值班 值守 密切 关注 雨水 强化 监测 预报 预警 做好 水库 闸涵 工程 科学 调度 落实 各项 防御 措施 加大 防洪工程 巡查 力度 提早 转移 威胁 群众 险情 及早 处置 确保安全 度汛 河北 日报 客户端,"洪水, 应急, 防御, 工作, 做好"
7,29,河北省 水利厅 水旱灾害 防御 应急 响应 工作 规程 河北省 水利厅 决定 今日 针对 全省 水利 系统启动 洪水 防御 应急 响应 据预测 今年 台风 杜苏芮 福建 广东 附近 登陆 随后 西北 方向 移动 受其 登陆 影响 日至 河北 大部 大到暴雨 局地 大暴雨 三河 永定河 大清河 子牙河 漳卫河 河系 可能 发生 洪水 本次 台风 具有 强度 水汽 量足 影响 范围广 持续时间 特点 水利厅 要求 各地 单位 高度重视 进一步 压实 防御 责任 加强 值班 值守 密切 关注 雨水 强化 监测 预报 预警 做好 水库 闸涵 工程 科学 调度 落实 各项 防御 措施 加大 防洪工程 巡查 力度 提早 转移 威胁 群众 险情 及早 处置 确保安全 度汛 来源 纵览 新闻 客户端,"洪水, 应急, 防御, 工作, 做好"
8,27,台风 杜苏芮 带来 大到暴雨 氛围 到位,"没下, 现在, 下雨, 别下, 台风"
9,27,台风 杜苏芮 带来 大到暴雨 赶紧,"没下, 现在, 下雨, 别下, 台风"
10,29,台风 杜苏芮 带来 大到暴雨 河北省 水利厅 水旱灾害 防御 应急 响应 工作 规程 水利厅 决定 今天 针对 全省 水利 系统启动 洪水 防御 应急 响应 据预测 今年 台风 杜苏芮 福建 广东 附近 登陆 随后 西北 方向 移动 受其 登陆 影响 日至 河北 大部 大到暴雨 局地 大暴雨 三河 永定河 大清河 子牙河 漳卫河 河系 可能 发生 洪水 本次 台风 具有 强度 水汽 量足 影响 范围广 持续时间 特点 水利厅 要求 各地 单位 高度重视 进一步 压实 防御 责任 加强 值班 值守 密切 关注 雨水 强化 监测 预报 预警 做好 水库 闸涵 工程 科学 调度 落实 各项 防御 措施 加大 防洪工程 巡查 力度 提早 转移 威胁 群众 险情 及早 处置 确保安全 度汛 河北 日报,"洪水, 应急, 防御, 工作, 做好"
11,29,台风 杜苏芮 带来 大到暴雨 河北省 水利厅 水旱灾害 防御 应急 响应 工作 规程 水利厅 决定 今天 针对 全省 水利 系统启动 洪水 防御 应急 响应 据预测 今年 台风 杜苏芮 福建 广东 附近 登陆 随后 西北 方向 移动 受其 登陆 影响 日至 河北 大部 大到暴雨 局地 大暴雨 三河 永定河 大清河 子牙河 漳卫河 河系 可能 发生 洪水 本次 台风 具有 强度 水汽 量足 影响 范围广 持续时间 特点 水利厅 要求 各地 单位 高度重视 进一步 压实 防御 责任 加强 值班 值守 密切 关注 雨水 强化 监测 预报 预警 做好 水库 闸涵 工程 科学 调度 落实 各项 防御 措施 加大 防洪工程 巡查 力度 提早 转移 威胁 群众 险情 及早 处置 确保安全 度汛 河北 日报,"洪水, 应急, 防御, 工作, 做好"
12,2,预计 当前 房山 门头沟 昌平 东部 怀柔 密云 平谷 顺义 海淀 丰台 朝阳 石景山 西城 东城 大兴 通州 部分 地区 出现 小时 降雨量 毫米 以上 短时 强降水 山区 山区 出现 强降水 诱发 中小 河流 洪水 山洪 地质灾害 次生 灾害 风险 较大 城市 低洼地区 容易 出现 积水 注意 防范 精准 天气预报 实时 天气 预警,"出现, 大暴雨, 山区, 夜间, 山洪"
13,-1,海淀,异常值
14,14,已经 预报,"预报, 思考, 单身, 话筒, 暴雨"
15,14,窗户 进屋 预报 允悲,"预报, 思考, 单身, 话筒, 暴雨"
16,17,延庆,"关注, 延庆, 现在, 多久, 顺义"
17,-1,延庆 哗哗 就算 编文 差点儿 意思,异常值
18,27,下雨 降温,"没下, 现在, 下雨, 别下, 台风"
19,27,大风,"没下, 现在, 下雨, 别下, 台风"
20,17,亦庄,"关注, 延庆, 现在, 多久, 顺义"
21,27,通州 没下,"没下, 现在, 下雨, 别下, 台风"
22,17,赶紧,"关注, 延庆, 现在, 多久, 顺义"
23,27,没下,"没下, 现在, 下雨, 别下, 台风"
24,33,预报 天气预报 预报 天气,"今天, 天气, 台风, 影响, 暴雨"
25,17,字数,"关注, 延庆, 现在, 多久, 顺义"
26,33,半天,"今天, 天气, 台风, 影响, 暴雨"
27,17,这得 多久,"关注, 延庆, 现在, 多久, 顺义"
28,27,啥时候 下班 回不去,"没下, 现在, 下雨, 别下, 台风"
29,-1,通州,异常值
30,27,昌平 嗷嗷 大泪,"没下, 现在, 下雨, 别下, 台风"
31,27,下雨 丰台 没下 允悲,"没下, 现在, 下雨, 别下, 台风"
32,35,北京 允悲,"北京, 洪水, 预警, 发布, 蓝色"
33,35,不算 北京,"北京, 洪水, 预警, 发布, 蓝色"
34,27,赶上 台风,"没下, 现在, 下雨, 别下, 台风"
35,17,延庆 没事,"关注, 延庆, 现在, 多久, 顺义"
36,-1,知道 剩下 区允悲,异常值
37,17,允悲,"关注, 延庆, 现在, 多久, 顺义"
38,17,延庆,"关注, 延庆, 现在, 多久, 顺义"
39,14,已经 预报,"预报, 思考, 单身, 话筒, 暴雨"
40,27,没下,"没下, 现在, 下雨, 别下, 台风"
41,2,防汛 提示 气象台 发布 暴雨 蓝色 预警 信号 预计 当前 房山 门头沟 昌平 东部 怀柔 密云 平谷 顺义 海淀 丰台 朝阳 石景山 西城 东城 大兴 通州 部分 地区 出现 小时 降雨量 毫米 以上 短时 强降水 山区 山区 出现 强降水 诱发 中小 河流 洪水 山洪 地质灾害 次生 灾害 风险 较大 城市 低洼地区 容易 出现 积水 注意 防范,"出现, 大暴雨, 山区, 夜间, 山洪"
42,14,话筒 话筒 话筒,"预报, 思考, 单身, 话筒, 暴雨"
43,33,据说 台风 影响 几天 京津冀 大暴雨,"今天, 天气, 台风, 影响, 暴雨"
44,-1,希望 北京 有太大 影响 害怕 北京 大暴雨 允悲,异常值
45,33,关注 台风 影响 今天 专业人士 告诉 不确定性 大概 明晚 确定 下来 北京 影响,"今天, 天气, 台风, 影响, 暴雨"
46,-1,香山 雨大,异常值
47,17,顺义,"关注, 延庆, 现在, 多久, 顺义"
48,34,即将 横扫 中心 城区 注意 防雹,"城区, 地区, 防汛, 半夜, 地下"
49,13,石景山 已经 再次 路上,"山洪, 暴雨, 不要, 了解, 洪水"
50,19,顺义 南彩,"天气, 安全, 出行, 收好, 这份"
51,-1,河北,异常值
52,17,没错,"关注, 延庆, 现在, 多久, 顺义"
53,-1,延庆 海淀 一路 暴雨 吓死 昌平 海淀 知道 啥时候,异常值
54,27,朝阳区 估计 洗洗,"没下, 现在, 下雨, 别下, 台风"
55,26,来广营 没到,"注意安全, 安全, 话筒, 平安, 晚安"
56,33,天天 预警 全市 几个 站点 强降水 别跟我 夏天 本来 不好 专业性,"今天, 天气, 台风, 影响, 暴雨"
57,-1,春游 家族,异常值
58,19,南五环 风大 打闪 下雨,"天气, 安全, 出行, 收好, 这份"
59,-1,海淀 暴雨 现在 中雨,异常值
60,27,下雨 可大 祈祷 祈祷 祈祷,"没下, 现在, 下雨, 别下, 台风"
61,27,朝阳 崔各庄 不下,"没下, 现在, 下雨, 别下, 台风"
62,26,坐标 正阳 气氛 到位 允悲,"注意安全, 安全, 话筒, 平安, 晚安"
63,17,吓人,"关注, 延庆, 现在, 多久, 顺义"
64,17,持续 多久,"关注, 延庆, 现在, 多久, 顺义"
65,14,为啥 延庆,"预报, 思考, 单身, 话筒, 暴雨"
66,27,昌平 西部,"没下, 现在, 下雨, 别下, 台风"
67,2,暴雨 蓝色 预警 信号 北京市 气象台 发布 暴雨 蓝色 预警 信号 预计 当前 房山 门头沟 昌平 东部 怀柔 密云 平谷 顺义 海淀 丰台 朝阳 石景山 西城 东城 大兴 通州 部分 地区 出现 小时 降雨量 毫米 以上 短时 强降水 山区 山区 出现 强降水 诱发 中小 河流 洪水 山洪 地质灾害 次生 灾害 风险 较大 城市 低洼地区 容易 出现 积水 注意 防范,"出现, 大暴雨, 山区, 夜间, 山洪"
68,0,北京 大兴 消防 超话 发布 雷电 黄色 预警 信号 气象台 发布 雷电 黄色 预警 信号 部分 地区 出现 小时 降雨量 毫米 以上 短时 强降水 山区 山区 出现 强降水 诱发 中小 河流 洪水 山洪 地质灾害 次生 灾害 风险 较大 城市 低洼地区 容易 出现 积水 注意 防范,"大暴雨, 出现, 暴雨, 西部, 山区"
69,2,防汛 提示 气象台 发布 暴雨 蓝色 预警 信号 预计 当前 房山 门头沟 昌平 东部 怀柔 密云 平谷 顺义 海淀 丰台 朝阳 石景山 西城 东城 大兴 通州 部分 地区 出现 小时 降雨量 毫米 以上 短时 强降水 山区 山区 出现 强降水 诱发 中小 河流 洪水 山洪 地质灾害 次生 灾害 风险 较大 城市 低洼地区 容易 出现 积水 注意 防范,"出现, 大暴雨, 山区, 夜间, 山洪"
70,2,北京市 气象局 消息 预计 当前 房山 门头沟 昌平 东部 怀柔 密云 平谷 顺义 海淀 丰台 朝阳 石景山 西城 东城 大兴 通州 部分 地区 出现 小时 降雨量 毫米 以上 短时 强降水 山区 山区 出现 强降水 诱发 中小 河流 洪水 山洪 地质灾害 次生 灾害 风险 较大 城市 低洼地区 容易 出现 积水 注意 防范 防汛 提示 防汛 办已 启动 朝阳 海淀 丰台 石景山 通州 昌平区 防汛 蓝色 预警 响应 单位 做好 防汛 相关 工作,"出现, 大暴雨, 山区, 夜间, 山洪"
71,2,部分 区有 短时 强降雨 北京市 气象台 发布 雷电 黄色 预警 信号 发布 大风 黄色 预警 发布 暴雨 蓝色 预警 信号 预计 当前 房山 门头沟 昌平 东部 怀柔 密云 平谷 顺义 海淀 丰台 朝阳 石景山 西城 东城 大兴 通州 部分 地区 出现 小时 降雨量 毫米 以上 短时 强降水 山区 山区 出现 强降水 诱发 中小 河流 洪水 山洪 地质灾害 次生 灾害 风险 较大 城市 低洼地区 容易 出现 积水 注意 防范 北京日报,"出现, 大暴雨, 山区, 夜间, 山洪"
72,-1,国家 防总 应急 管理部 滚动 会商 部署 台风 杜苏芮 西南 强降雨 防范 应对 国家 防总 总指挥 应急 管理部 部长 王祥喜 同志 安排 部署 国家 防总 办公室 应急 管理部 持续 组织 防汛防台 专题 会商 调度 中国气象局 水利部 自然资源 会商 研判 台风 杜苏芮 发展 态势 连线 福建 广东 浙江 江西 四川 省份 防指 办公室 部署 加强 重点 地区 防汛防台 工作 应急 管理部 副部长 水利部 副部长 王道 主持 会商 会商 研判 台风 杜苏芮 具有 登陆 强度 影响 时间 范围广 雨量 北上 深入 内陆 不利因素 西南地区 降雨 持续 防汛防台 形势严峻 会商 强调 各地 部门 坚决 贯彻落实 习近平 总书记 防汛 救灾 工作 重要 指示精神 克服 麻痹思想 侥幸心理 树牢 底线 思维 极限 思维 进一步 压紧 压实 回港 避风 船只 上岸 避险 人员 安全 管理 隐患 排查 整改 各项 台风 防御 措施 细化 成都 大运会 重大 活动 防洪 保安 措施 落实 预警 应急 响应 联动 人员 转移 避险 险情 灾情 应急 处置 强降雨 防御 准备 严肃 防汛 纪律 强化 应急 响应 期间 责任 落实 值班 值守 信息 报送 工作 国家 防总 办公室 日向 北京 天津 河北 山西 江苏 浙江 安徽 福建 江西 山东 河南 湖北 广东省 防汛 抗旱 指挥部 相关 流域 防汛 抗旱 总指挥部 印发 通知 部署 做好 台风 杜苏芮 暴雨 洪水 防御 工作 国家 防总 针对 福建 广东 浙江 江西 省份 维持 防汛防台 三级 应急 响应 针对 西南地区 维持 防汛 四级 应急 响应 派出 工作组 重点 地区 协助 做好 防汛防台 工作 应急 管理部,异常值
73,29,河北省 水利厅 水旱灾害 防御 应急 响应 工作 规程 水利厅 决定 今天 针对 全省 水利 系统启动 洪水 防御 应急 响应 据预测 今年 台风 杜苏芮 福建 广东 附近 登陆 随后 西北 方向 移动 受其 登陆 影响 日至 河北 大部 大到暴雨 局地 大暴雨 三河 永定河 大清河 子牙河 漳卫河 河系 可能 发生 洪水 本次 台风 具有 强度 水汽 量足 影响 范围广 持续时间 特点 水利厅 要求 各地 单位 高度重视 进一步 压实 防御 责任 加强 值班 值守 密切 关注 雨水 强化 监测 预报 预警 做好 水库 闸涵 工程 科学 调度 落实 各项 防御 措施 加大 防洪工程 巡查 力度 提早 转移 威胁 群众 险情 及早 处置 确保安全 度汛 河北 日报 苑立立,"洪水, 应急, 防御, 工作, 做好"
74,28,国家 发改委 入夏 以来 全国 调度 发电量 三创 历史 新高 截至 目前 全国 电力 运行 平稳 有序 进一步 完善 电价 政策 市场机制 国家 能源 电源 投产 情况 基本 符合 电力 供需 预期 要求 截至 南水北调 中线 工程 北京 输水 亿立方米 水质 始终 稳定 地表水 环境 质量标准 以上 北京市 直接 受益 人口 超过 万人 第六届 博会 国家 综合 展将 恢复 线下 举办 设立 主宾 中国馆 升级 扩容 平方米 规模 达到 历届 水利部 滚动 安排 部署 台风 杜苏芮 暴雨 洪水 防御 工作 杜苏芮 闽粤 沿海 登陆 西南地区 强降雨 登陆 深入 内陆 河北 河南 山东 或现 明显 降雨,"毫米, 应急, 做好, 防汛, 组织"
75,33,天津 洪水 回家,"今天, 天气, 台风, 影响, 暴雨"
76,33,半夜 睡醒 廊坊 天气 大雨 暴雨 有点 害怕 为啥 回家 两天 赶上 暴雨 廊坊 排水系统 真是 堪忧,"今天, 天气, 台风, 影响, 暴雨"
77,36,河北 河流 可能 发生 洪水 台风 杜苏芮 影响 日至 河北 局地 大暴雨 三河 永定河 大清河 子牙河 漳卫河 河系 可能 发生 洪水 河北省 启动 洪水 防御 应急 响应,"洪水, 流域, 预警, 蓝色, 永定河"
